"Spring AI 프로젝트의 주요 목표는 무엇인가요?","Spring AI 프로젝트의 주요 목표는 불필요한 복잡성 없이 인공지능 기능을 통합하는 애플리케이션의 개발을 간소화하는 것입니다. (출처: https://docs.spring.io/spring-ai/reference/1.0-SNAPSHOT/index.html#api/moderation)"
"Spring AI는 어떤 프로그래밍 언어에서 사용할 수 있나요?","Spring AI는 Python뿐만 아니라 다양한 프로그래밍 언어에서 사용할 수 있도록 설계되었습니다. (출처: https://docs.spring.io/spring-ai/reference/1.0-SNAPSHOT/index.html#api/moderation)"
"Spring AI 프로젝트에서 어떤 AI 모델 제공업체를 지원하나요?","Spring AI 프로젝트는 OpenAI, Microsoft, Amazon, Google, Hugging Face와 같은 주요 모델 제공업체를 지원합니다. (출처: https://docs.spring.io/spring-ai/reference/1.0-SNAPSHOT/index.html#api/moderation)"
"Spring AI에서 OpenAI의 Moderation 모델을 어떻게 사용할 수 있나요?","OpenAI 계정을 만들고 API 키를 얻은 후, 프로젝트의 빌드 파일에 spring-ai-openai 종속성을 추가하고 OpenAI Text-to-Speech Client에 대한 Spring AI 자동 구성을 활성화하세요. 그런 다음 OpenAiModerationModel을 만들고 call 메서드를 사용하여 Moderation 결과를 검색하세요. spring.ai.openai.moderation 접두사를 사용하여 OpenAI Moderation 모델을 구성하고 런타임에서 OpenAiModerationOptions 클래스를 사용하여 옵션을 재정의할 수 있습니다. https://docs.spring.io/spring-ai/reference/1.0-SNAPSHOT/api/moderation/openai-moderation.html"
"Spring AI에서 OpenAI Moderation 모델의 런타임 옵션을 어떻게 재정의하나요?","OpenAiModerationOptions 클래스를 사용하여 Moderation 요청을 할 때 사용할 옵션을 제공합니다. 시작 시 spring.ai.openai.moderation에 지정된 옵션을 사용하지만 런타임에서 이를 재정의할 수 있습니다. OpenAiModerationOptions 객체를 만들고 원하는 속성을 설정한 다음 ModerationPrompt를 만들고 call 메서드를 사용하여 ModerationResponse를 검색하세요. 그런 다음 ModerationResponse의 getResult() 메서드를 사용하여 Moderation 객체에 액세스하고 다양한 get 메서드를 사용하여 다양한 필드에 액세스하세요. https://docs.spring.io/spring-ai/reference/1.0-SNAPSHOT/api/moderation/openai-moderation.html"
"Spring AI에서 OpenAI Moderation 모델을 수동으로 구성하려면 어떻게 해야 하나요?","프로젝트의 Maven pom.xml 또는 Gradle build.gradle 파일에 spring-ai-openai 종속성을 추가하고 OpenAiModerationApi 객체를 만들어 API 키를 전달하세요. 그런 다음 OpenAiModerationModel 객체를 만들고 OpenAiModerationOptions 객체를 만들고 원하는 속성을 설정한 다음 ModerationPrompt 객체를 만들고 call 메서드를 사용하여 ModerationResponse를 검색하세요. 그런 다음 ModerationResponse의 getResult() 메서드를 사용하여 Moderation 객체에 액세스하고 다양한 get 메서드를 사용하여 다양한 필드에 액세스하세요. https://docs.spring.io/spring-ai/reference/1.0-SNAPSHOT/api/moderation/openai-moderation.html"
"벡터 데이터베이스란 무엇이며 어떤 역할을 하는가?","벡터 데이터베이스는 AI 애플리케이션에서 필수적인 역할을 하는 특수한 유형의 데이터베이스입니다. 벡터 데이터베이스에서는 쿼리가 전통적인 관계형 데이터베이스와 달리 정확한 일치가 아닌 유사도 검색을 수행합니다. 벡터 데이터베이스는 데이터를 AI 모델과 통합하기 위해 사용되며, 벡터 데이터베이스에서 쿼리로 벡터를 제공하면 쿼리 벡터와 '유사한' 벡터를 반환합니다. 자세한 내용은 Vector Similarity(vectordbs/understand-vectordbs.html#vectordbs-similarity)에서 제공됩니다."
"Spring AI의 VectorStore 인터페이스와 관련된 클래스는 무엇인가요?","Spring AI의 VectorStore 인터페이스와 관련된 클래스는 VectorStore 인터페이스 자체와 SearchRequest 빌더입니다. VectorStore 인터페이스 정의는 다음과 같습니다: public interface VectorStore { void add(List<Document> documents); Optional<Boolean> delete(List<String> idList); List<Document> similaritySearch(String query); List<Document> similaritySearch(SearchRequest request); } 그리고 관련된 SearchRequest 빌더: public class SearchRequest { public final String query; private int topK = 4; private double similarityThreshold = SIMILARITY_THRESHOLD_ALL; private Filter.Expression filterExpression; public static SearchRequest query(String query) { return new SearchRequest(query); } private SearchRequest(String query) { this.query = query; } public SearchRequest withTopK(int topK) {...} public SearchRequest withSimilarityThreshold(double threshold) {...} public SearchRequest withSimilarityThresholdAll() {...} public SearchRequest withFilterExpression(Filter.Expression expression) {...} public SearchRequest withFilterExpression(String textExpression) {...} public String getQuery() {...} public int getTopK() {...} public double getSimilarityThreshold() {...} public Filter.Expression getFilterExpression() {...} }"
"벡터 데이터베이스에서 데이터를 삽입하려면 어떻게 해야 하나요?","벡터 데이터베이스에 데이터를 삽입하려면 Document 객체 내에 데이터를 캡슐화해야 합니다. Document 클래스는 PDF 또는 Word 문서와 같은 데이터 소스의 내용을 캡슐화하고 문자열로 표현된 텍스트와 함께 메타데이터를 키-값 쌍으로 포함합니다. 벡터 데이터베이스에 삽입하면 텍스트 내용이 임베딩 모델을 사용하여 벡터 임베딩이라고 하는 숫자 배열 또는 float[]로 변환됩니다. 임베딩 모델은 Word2Vec, GLoVE, BERT 또는 OpenAI의 text-embedding-ada-002와 같은 것으로, 단어, 문장 또는 단락을 이러한 벡터 임베딩으로 변환하는 데 사용됩니다."
"Azure Search Service는 어떤 목적으로 사용되나요?","Azure AI Search Service는 Microsoft의 AI 플랫폼 중 하나로, 문서 임베딩을 저장하고 유사도 검색을 수행하기 위한 Azure VectorStore를 설정하는 데 사용됩니다. (출처: https://docs.spring.io/spring-ai/reference/1.0-SNAPSHOT/api/vectordbs/azure.html)"
"Azure VectorStore를 설정하기 위해 필요한 사전 요구 사항은 무엇인가요?","Azure VectorStore를 설정하기 위해 필요한 사전 요구 사항은 Azure 구독과 Azure AI Search Service입니다. (출처: https://docs.spring.io/spring-ai/reference/1.0-SNAPSHOT/api/vectordbs/azure.html)"
"Azure VectorStore를 설정하는 데 필요한 구성 속성은 어떤 것이 있나요?","Azure VectorStore를 설정하는 데 사용할 수 있는 구성 속성은 spring.ai.vectorstore.azure.api-key, spring.ai.vectorstore.azure.initialize-schema, spring.ai.vectorstore.azure.index-name, spring.ai.vectorstore.azure.default-top-k, spring.ai.vectorstore.azure.default-similarity-threshold, spring.ai.vectorstore.azure.embedding-property, spring.ai.vectorstore.azure.index-name 등이 있습니다. (출처: https://docs.spring.io/spring-ai/reference/1.0-SNAPSHOT/api/vectordbs/azure.html)"
"아파치 카산드라는 어떤 용도로 사용되는 분산 데이터베이스인가요?","아파치 카산드라는 선형 확장성, 검증된 내결함성 및 낮은 지연 시간을 갖춘 진정한 오픈 소스 분산 데이터베이스로, 중요한 트랜잭션 데이터에 적합한 플랫폼입니다."
"JVector는 다른 HNSW Vector Similarity Search 구현과 비교하여 어떤 점에서 뛰어난가요?","JVector는 알고리즘적으로 빠르며, DiskANN 및 관련 연구에서 영감을 받은 최신 그래프 알고리즘을 사용하여 높은 재현율과 낮은 지연 시간을 제공합니다. 또한 구현이 빠르고, 메모리를 효율적으로 사용하며, 쉽게 포함시킬 수 있는 API를 제공합니다."
"DocumentStore를 사용하여 RAG 애플리케이션에 필요한 종속성을 어떻게 추가하나요?","DocumentStore를 사용하여 RAG 애플리케이션에 필요한 종속성을 추가하려면, 프로젝트에 다음 종속성을 추가해야 합니다: spring-ai-cassandra-store 또는 spring-ai-cassandra-store-spring-boot-starter. 또한 Spring AI BOM을 빌드 파일에 추가하려면 종속성 관리 섹션을 참조하십시오."
"Spring AI에서 Elasticsearch Vector Store를 설정하기 위한 전제 조건은 무엇인가요?","Spring AI에서 Elasticsearch Vector Store를 설정하기 위한 전제 조건은 실행 중인 Elasticsearch 인스턴스입니다."
"Elasticsearch를 사용하기 위해 추가해야 하는 의존성은 무엇인가요?","Elasticsearch를 사용하기 위해 추가해야 하는 의존성은 <dependency> <groupId>org.springframework.ai</groupId> <artifactId>spring-ai-elasticsearch-store-spring-boot-starter</artifactId> </dependency>입니다."
"Elasticsearch Vector Store를 수동으로 구성하려면 어떤 의존성을 추가해야 하나요?","Elasticsearch Vector Store를 수동으로 구성하려면 <dependency> <groupId>org.springframework.ai</groupId> <artifactId>spring-ai-elasticsearch-store</artifactId> </dependency>를 추가해야 합니다."
"GemFire VectorDB는 무엇인가요?","GemFire VectorDB는 GemFire의 기능을 확장한 것으로, 효율적인 벡터 저장, 검색 및 벡터 유사도 검색을 수행하는 다목적 벡터 데이터베이스입니다. (출처: <https://docs.spring.io/spring-ai/reference/1.0-SNAPSHOT/api/vectordbs/gemfire.html>)"
"GemFire VectorStore를 Spring Boot 프로젝트에 구성하려면 어떻게 해야 하나요?","GemFire VectorStore Spring Boot 스타터를 프로젝트의 Maven build 파일 pom.xml 또는 Gradle build.gradle 파일에 추가하고, 구성 속성을 사용하여 GemFireVectorStore를 추가로 구성할 수 있습니다. (출처: <https://docs.spring.io/spring-ai/reference/1.0-SNAPSHOT/api/vectordbs/gemfire.html>)"
"GemFire VectorStore를 사용하여 유사도 검색을 수행하려면 어떻게 해야 하나요?","먼저, VectorStore 인터페이스를 구현하는 GemfireVectorStore 인스턴스를 만듭니다. 그런 다음, 문서를 저장하고 SimilaritySearchRequest 객체를 사용하여 유사도 검색을 수행할 수 있습니다. (출처: <https://docs.spring.io/spring-ai/reference/1.0-SNAPSHOT/api/vectordbs/gemfire.html>)"
"밀루스는 어떤 종류의 데이터베이스인가요?","밀루스는 벡터 데이터베이스로, 데이터 과학과 기계 학습 분야에서 사용됩니다. (출처: https://docs.spring.io/spring-ai/reference/1.0-SNAPSHOT/api/vectordbs/milvus.html)"
"밀루스에서 사용 가능한 인덱스 유형은 무엇인가요?","밀루스에서는 IVF_FLAT, IVF_SQ8, IVF_HNSW 세 가지 인덱스 유형을 사용할 수 있습니다. (출처: https://docs.spring.io/spring-ai/reference/1.0-SNAPSHOT/api/vectordbs/milvus.html)"
"밀루스 벡터스토어에서 사용할 수 있는 메트릭 유형은 무엇인가요?","밀루스 벡터스토어에서는 COSINE, L2, IP 메트릭 유형을 사용할 수 있습니다. (출처: https://docs.spring.io/spring-ai/reference/1.0-SNAPSHOT/api/vectordbs/milvus.html)"
"Spring AI에서 MongoDB Atlas를 벡터 스토어로 설정하는 방법은 무엇인가요?","Spring AI에서 MongoDB Atlas를 벡터 스토어로 설정하려면, MongoDB Atlas를 구성하고, 문서 임베딩을 계산하기 위한 EmbeddingModel 인스턴스를 만들고, Java 애플리케이션을 설정할 환경을 마련해야 합니다. 또한, Spring AI의 Spring Boot 자동 설정을 활성화하기 위해 프로젝트의 빌드 파일에 적절한 종속성을 추가해야 합니다. 또한, 적절한 생성자에서 initializeSchema 부울 값을 지정하거나 application.properties 파일에서 spring.ai.vectorstore.mongodb.initialize-schema=true를 설정하여 필요한 스키마를 초기화할 수 있습니다. 스키마 초기화를 위해 Spring AI BOM을 빌드 파일에 추가해야 하며, Milestone 및/또는 Snapshot 저장소를 빌드 파일에 추가해야 합니다."
"Spring AI MongoDB Atlas 벡터 스토어에서 스키마를 수동으로 구성하려면 어떻게 해야 하나요?","Spring AI MongoDB Atlas 벡터 스토어에서 스키마를 수동으로 구성하려면, MongoDBAtlasVectorStore 및 해당 종속성을 직접 설정하여 자동 설정 없이 구성할 수 있습니다. MongoDBAtlasVectorStore와 함께 MongoTemplate 및 EmbeddingModel 인스턴스를 사용하여 벡터 스토어를 구성할 수 있습니다. 또한, MongoDBAtlasVectorStoreConfig 객체를 사용하여 벡터 저장소의 컬렉션 이름, 벡터 인덱스 이름, 벡터 저장되는 경로, 필터링할 메타데이터 필드 등 다양한 구성 속성을 구성할 수 있습니다."
"Spring AI MongoDB Atlas 벡터 스토어에서 쿼리 시 메타데이터 필터링을 어떻게 수행하나요?","Spring AI MongoDB Atlas 벡터 스토어에서 쿼리 시 메타데이터 필터링을 수행하려면, MongoDBAtlasFilterExpressionConverter 클래스를 사용하여 필터 표현을 MongoDB Atlas 메타데이터 필터 표현으로 변환할 수 있습니다. 지원되는 작업에는 $and, $or, $eq, $ne, $lt, $lte, $gt, $gte, $in, $nin이 포함됩니다. 이러한 연산자를 사용하여 벡터 검색과 함께 문서와 연결된 메타데이터 필드에 필터링 로직을 적용할 수 있습니다. 예를 들어, $eq 연산자를 사용하여 'author' 필드가 'A'인 검색 결과를 필터링할 수 있습니다."
"Neo4j는 어떤 종류의 데이터베이스인가요?","Neo4j는 오픈 소스 NoSQL 그래프 데이터베이스입니다."
"Neo4j에서 인덱싱은 어떻게 이루어지나요?","Neo4j의 벡터 검색은 Lucene을 사용하여 Hierarchical Navigable Small World Graph (HNSW)를 통해 벡터 필드에 대한 k 근사 이웃 (k-ANN) 쿼리를 수행합니다."
"Neo4jVectorStore에서 임베딩 차원을 설정하는 방법은 무엇인가요?","Spring Boot 구성에서 spring.ai.vectorstore.neo4j.embedding-dimension 속성을 사용하여 임베딩 차원을 설정할 수 있습니다."
"엘라스틱서치에서 포크된 오픈소스 검색 및 분석 엔진은 무엇인가요?","오픈서치(OpenSearch)입니다. (출처: https://docs.spring.io/spring-ai/reference/1.0-SNAPSHOT/api/vectordbs/opensearch.html)"
"오픈서치는 어떤 라이선스로 배포되나요?","아파치 라이선스 2.0으로 배포됩니다. (출처: https://docs.spring.io/spring-ai/reference/1.0-SNAPSHOT/api/vectordbs/opensearch.html)"
"오픈서치는 어떤 유형의 검색 기능을 지원하나요?","벡터, 어휘 및 하이브리드 검색 기능을 지원합니다. (출처: https://docs.spring.io/spring-ai/reference/1.0-SNAPSHOT/api/vectordbs/opensearch.html)"
"Spring AI Oracle VectorStore를 사용하여 데이터베이스에 연결하고 구성하는 방법은 무엇인가요?","OracleVectorStore를 연결하고 구성하려면 데이터베이스에 대한 액세스 세부 정보를 제공해야 합니다. 간단한 구성은 Spring Boot의 application.yml 또는 application.properties 파일에서 다음과 같이 제공할 수 있습니다: spring.datasource.url: jdbc:oracle:thin:@//localhost:1521/freepdb1, spring.datasource.username: mlops, spring.datasource.password: mlops, ai.vectorstore.oracle.index-type: IVF, ai.vectorstore.oracle.distance-type: COSINE, ai.vectorstore.oracle.dimensions: 1536 (출처: https://docs.spring.io/spring-ai/reference/1.0-SNAPSHOT/api/vectordbs/oracle.html)"
"Spring AI Oracle VectorStore에서 스키마를 초기화하는 방법은 무엇인가요?","OracleVectorStore에서 스키마를 초기화하려면 initializeSchema 매개변수를 true로 설정하거나 application.properties 파일에서 initialize-schema=true로 설정해야 합니다. 스키마 초기화는 이제 기본적으로 발생하지 않으며, 필요한 경우에만 수행해야 하는 breaking change입니다. (출처: https://docs.spring.io/spring-ai/reference/1.0-SNAPSHOT/api/vectordbs/oracle.html)"
"Spring AI Oracle VectorStore에서 사용 가능한 구성을 구성하는 방법은 무엇인가요?","Spring AI Oracle VectorStore에서 사용 가능한 구성은 spring.ai.vectorstore.oracle.index-type, spring.ai.vectorstore.oracle.distance-type, spring.ai.vectorstore.oracle.dimensions와 같은 Spring Boot 구성 속성을 사용하여 사용자 지정할 수 있습니다. 이러한 속성의 기본값 및 구성 옵션에 대한 자세한 내용은 https://docs.spring.io/spring-ai/reference/1.0-SNAPSHOT/api/vectordbs/oracle.html을 참조하십시오. (출처: https://docs.spring.io/spring-ai/reference/1.0-SNAPSHOT/api/vectordbs/oracle.html)"
"PGvector를 사용하여 벡터 임베딩을 저장하고 유사도 검색을 수행하려면 어떤 단계를 거쳐야 하나요?","PostgreSQL 인스턴스에 액세스하고 vector, hstore 및 uuid-ossp 확장을 활성화한 다음, Docker Compose 또는 Testcontainers를 통해 Spring Boot dev 서비스로 PGvector 데이터베이스를 실행하거나 Docker 컨테이너를 사용하여 로컬에서 DB를 설정할 수 있습니다. 시작 시 PgVectorStore는 필요한 데이터베이스 확장을 설치하고 필요한 vector_store 테이블과 인덱스를 생성하려고 시도합니다. 필요한 경우 수동으로 수행할 수도 있으며, 쿼리에서 사용할 임베딩 모델을 위한 API 키를 가져와야 합니다."
"PGVector를 사용하여 PgVectorStore를 구성하려면 어떻게 해야 하나요?","Spring Boot의 application.yml을 통해 간단한 구성을 제공하거나 Spring Boot 자동 구성을 사용하지 않고 PgVectorStore를 수동으로 구성할 수 있습니다. 수동으로 구성하려면 PostgreSQL 연결 및 JdbcTemplate 자동 구성 종속성을 프로젝트에 추가해야 합니다."
"PGVector의 구성 매개 변수를 어떻게 사용자 지정할 수 있나요?","Spring Boot 구성에서 다음 매개 변수를 사용하여 PGVector 벡터 저장소를 사용자 지정할 수 있습니다. index-type, distance-type, dimensions, remove-existing-vector-store-table, initialize-schema, schema-name 및 table-name입니다. 또한 spring.ai.vectorstore.pgvector.schema-validation을 true로 설정하여 스키마 및 테이블 이름 유효성 검사를 활성화할 수 있습니다."
"Pinecone VectorStore를 사용하기 위해 필요한 사전 요구 사항은 무엇인가요?","Pinecone 계정과 새로운 프로젝트, 인덱스를 생성하고 API 키를 생성해야 합니다."
"Pinecone VectorStore를 구성하기 위해 어떤 방법이 있나요?","Spring AI는 Pinecone Vector Store에 대한 Spring Boot 자동 구성을 제공합니다. 또는 PineconeVectorStoreConfig 빈을 만들고 PineconeVectorStore 생성자에 전달하여 수동으로 구성할 수 있습니다."
"Pinecone VectorStore에서 사용할 수 있는 구성 속성은 무엇인가요?","Pinecone API 키, 환경, 프로젝트 ID, 인덱스 이름 및 콘텐츠 필드 이름과 같은 속성을 구성할 수 있습니다."
"QdrantVectorStore를 사용하기 위해 어떤 요구사항이 필요한가요?","QdrantVectorStore를 사용하려면 Qdrant 인스턴스를 설치하고, 호스트, GRPC 포트, 컬렉션 이름, 그리고 필요한 경우 API 키와 같은 정보를 제공해야 합니다. 또한, 적절한 차원과 구성으로 Qdrant 컬렉션을 미리 생성하는 것이 좋습니다. 또한, 문서의 임베딩을 계산하기 위해 EmbeddingModel 인스턴스가 필요합니다."
"Qdrant 인스턴스에 연결하기 위해 어떻게 구성해야 하나요?","Spring Boot의 application.properties 파일을 사용하여 Qdrant 인스턴스에 대한 액세스 세부 정보를 제공해야 합니다. 제공해야 하는 속성에는 host, port, api-key, collection-name이 포함됩니다. 또한, TLS를 사용할지 여부를 구성할 수 있습니다."
"QdrantVectorStore에서 사용 가능한 속성은 어떤 것이 있나요?","Qdrant vector store를 사용자 정의하기 위해 host, port, api-key, collection-name, use-tls, initialize-schema 등의 속성을 사용할 수 있습니다. 이러한 속성은 기본값과 구성 옵션을 포함하여 Spring Boot 구성에서 설명되어 있습니다."
"RedisVectorStore에서 Redis는 어떤 용도로 사용되나요?","Redis는 문서의 임베딩을 저장하고 유사도 검색을 수행하는 데 사용됩니다."
"RedisVectorStore를 설정하기 위한 전제 조건은 무엇인가요?","RedisStack 인스턴스, 임베딩 모델을 계산하는 임베딩 모델 인스턴스, 그리고 필요한 경우 임베딩을 생성하기 위한 임베딩 모델의 API 키가 필요합니다."
"Spring AI는 Redis Vector Store 설정에 대한 자동 구성을 제공하나요?","네, Spring AI는 Redis Vector Store 설정에 대한 Spring Boot 자동 구성을 제공합니다."
"SAP HANA Cloud 벡터 엔진에서 벡터 저장소를 구성하려면 어떤 속성을 사용해야 하나요?","spring.datasource.driver-class-name, spring.datasource.url, spring.datasource.username, spring.datasource.password, spring.ai.vectorstore.hanadb.top-k, spring.ai.vectorstore.hanadb.table-name, spring.ai.vectorstore.hanadb.initialize-schema 속성을 사용할 수 있습니다. (출처: https://docs.spring.io/spring-ai/reference/1.0-SNAPSHOT/api/vectordbs/hana.html)"
"SAP HANA Cloud 벡터 저장소를 Spring Boot 프로젝트에 구성하려면 어떤 종속성을 추가해야 하나요?","spring-ai-hanadb-store-spring-boot-starter 종속성을 추가할 수 있습니다. (출처: https://docs.spring.io/spring-ai/reference/1.0-SNAPSHOT/api/vectordbs/hana.html)"
"SAP HANA Cloud 벡터 저장소를 사용하여 Spring AI에서 RAG 애플리케이션을 구현하려면 어떻게 해야 하나요?","SAP HANA Cloud를 벡터 DB로 사용하고 OpenAI를 활용하여 RAG 패턴을 구현하는 프로젝트를 설정하고, CRICKET_WORLD_CUP 테이블을 생성하고, pom.xml에 필요한 종속성을 추가하고, application.properties 파일에 속성을 추가하고, CricketWorldCup 엔티티 클래스와 CricketWorldCupRepository 리포지토리 인터페이스를 구현하고, REST 컨트롤러 클래스를 생성하여 REST 엔드포인트를 정의해야 합니다. (출처: https://docs.spring.io/spring-ai/reference/1.0-SNAPSHOT/api/vectordbs/hana.html)"
"Weaviate는 무엇인가요?","Weaviate는 오픈 소스 벡터 데이터베이스로, 데이터 객체와 ML 모델의 벡터 임베딩을 저장하고 수십억 개의 데이터 객체로 원활하게 확장할 수 있습니다. 문서 임베딩, 콘텐츠 및 메타데이터를 저장하고 메타데이터 필터를 포함한 이러한 임베딩을 검색하는 도구를 제공합니다. (출처: <https://docs.spring.io/spring-ai/reference/1.0-SNAPSHOT/api/vectordbs/weaviate.html>)"
"WeaviateVectorStore를 사용하기 위한 전제 조건은 무엇인가요?","WeaviateVectorStore를 사용하기 위한 전제 조건은 문서 임베딩을 계산하기 위한 EmbeddingModel 인스턴스입니다. Transformers Embedding, OpenAI Embedding, Azure OpenAI Embedding 또는 PostgresML Embedding Model과 같은 여러 옵션이 있습니다. 또한 Weaviate 클러스터가 필요하며, Docker 컨테이너에서 로컬로 클러스터를 설정하거나 Weaviate Cloud Service를 만들 수 있습니다. (출처: <https://docs.spring.io/spring-ai/reference/1.0-SNAPSHOT/api/vectordbs/weaviate.html>)"
"WeaviateVectorStore를 Spring Boot 애플리케이션에 수동으로 구성하려면 어떻게 해야 하나요?","Spring Boot 자동 구성을 사용하는 대신 WeaviateVectorStore를 수동으로 구성하려면 프로젝트에 spring-ai-weaviate-store 종속성을 추가해야 합니다. 그런 다음 WeaviateClient를 만들고 사용자 정의 WeaviateVectorStoreConfig 객체를 사용하여 WeaviateVectorStore를 구성할 수 있습니다. (출처: <https://docs.spring.io/spring-ai/reference/1.0-SNAPSHOT/api/vectordbs/weaviate.html>)"
"Spring AI에서 어떤 AI 모델들이 기능 호출을 지원하나요?","Anthropic Claude, Azure OpenAI, Google VertexAI Gemini, Groq, Mistral AI, Ollama, OpenAI가 Spring AI에서 기능 호출을 지원합니다. (출처: <https://docs.spring.io/spring-ai/reference/1.0-SNAPSHOT/api/functions.html>)"
"Anthropic Claude의 기능 호출에 대한 자세한 문서는 어디에 있나요?","Anthropic Claude의 기능 호출에 대한 자세한 문서는 Anthropic Claude 기능 호출 문서(chat/functions/anthropic-chat-functions.html)에서 확인할 수 있습니다. (출처: <https://docs.spring.io/spring-ai/reference/1.0-SNAPSHOT/api/functions.html>)"
"Ollama의 기능 호출은 스트리밍을 지원하나요?","아니요, 현재 Ollama의 기능 호출은 스트리밍을 지원하지 않습니다. (출처: <https://docs.spring.io/spring-ai/reference/1.0-SNAPSHOT/api/functions.html>)"
