"Spring Cloud Train Reference Documentation의 목적은 무엇인가요?","Spring Cloud는 분산 시스템에서 일반적인 패턴(예: 구성 관리, 서비스 검색, 회로 차단기, 지능형 라우팅, 마이크로 프록시, 제어 버스)을 개발자가 빠르게 구축할 수 있는 도구를 제공합니다. 이를 통해 개발자는 자신의 노트북, 베어 메탈 데이터 센터 및 Cloud Foundry와 같은 관리 플랫폼을 포함한 모든 분산 환경에서 잘 작동하는 서비스 및 애플리케이션을 빠르게 구축할 수 있습니다. (출처: <https://docs.spring.io/spring-cloud-release/reference/2023.0/index.html>)"
"Spring Cloud Train Reference Documentation은 어떤 버전의 Spring Boot를 지원하나요?","Spring Cloud Train Reference Documentation은 Spring Boot 버전 3.2.7을 지원합니다. (출처: <https://docs.spring.io/spring-cloud-release/reference/2023.0/index.html>)"
"Spring Cloud Train Reference Documentation에서 어떤 기능이 제공되나요?","Spring Cloud는 일반적인 사용 사례에 대한 좋은 기본 경험과 다른 사용 사례를 커버하기 위한 확장 메커니즘을 제공하는 데 중점을 둡니다. 분산/버전 관리 구성, 서비스 등록 및 검색, 라우팅, 서비스 간 호출, 로드 밸런싱, 회로 차단기, 분산 메시징 등의 기능을 제공합니다. (출처: <https://docs.spring.io/spring-cloud-release/reference/2023.0/index.html>)"
"2023.0 버전의 Spring Cloud 문서에 대한 저작권은 누구에게 있나요?","2012-2023년입니다. (출처: https://docs.spring.io/spring-cloud-release/reference/2023.0/legal.html)"
"Spring Cloud 문서를 무료로 배포할 때 어떤 조건이 필요한가요?","문서를 복사하거나 배포할 때, 저작권 고지를 포함해야 합니다. (출처: https://docs.spring.io/spring-cloud-release/reference/2023.0/legal.html)"
"Spring Cloud 문서를 상업적인 목적으로 사용할 수 있나요?","공식 문서에는 명시되어 있지 않습니다. (출처: https://docs.spring.io/spring-cloud-release/reference/2023.0/legal.html)"
