"스프링 AI에서 미니맥스 임베딩 모델에 대한 리트라이 메커니즘을 구성하는 방법은 무엇인가요?","스프링 AI는 Azure MiniMax 임베딩 모델에 대한 Spring Boot 자동 구성을 제공합니다. 이를 활성화하려면 프로젝트의 Maven pom.xml 파일에 다음 종속성을 추가하십시오: <dependency> <groupId>org.springframework.ai</groupId> <artifactId>spring-ai-minimax-spring-boot-starter</artifactId> </dependency> 또는 Gradle build.gradle 빌드 파일에 추가하십시오. dependencies { implementation 'org.springframework.ai:spring-ai-minimax-spring-boot-starter' } Spring AI BOM을 빌드 파일에 추가하려면 종속성 관리(../../getting-started.html#dependency-management) 섹션을 참조하십시오. 리트라이 메커니즘은 spring.ai.retry 접두사를 사용하여 구성할 수 있습니다. 이 접두사는 Maximum number of retry attempts, Initial sleep duration for the exponential backoff policy, Backoff interval multiplier, Maximum backoff duration, If false, throw a NonTransientAiException, and do not attempt retry for 4xx client error codes, List of HTTP status codes that should not trigger a retry, List of HTTP status codes that should trigger a retry 등의 속성을 포함합니다. 기본값은 10, 2 sec., 5, 3 min., false, empty, empty입니다."
"스프링 AI에서 미니맥스 임베딩 모델에 대한 연결 속성을 구성하는 방법은 무엇인가요?","스프링 AI는 Azure MiniMax 임베딩 모델에 대한 Spring Boot 자동 구성을 제공합니다. 이를 활성화하려면 프로젝트의 Maven pom.xml 파일에 다음 종속성을 추가하십시오: <dependency> <groupId>org.springframework.ai</groupId> <artifactId>spring-ai-minimax-spring-boot-starter</artifactId> </dependency> 또는 Gradle build.gradle 빌드 파일에 추가하십시오. dependencies { implementation 'org.springframework.ai:spring-ai-minimax-spring-boot-starter' } 종속성 관리(../../getting-started.html#dependency-management) 섹션을 참조하여 빌드 파일에 Spring AI BOM을 추가하십시오. 연결 속성은 spring.ai.minimax 접두사를 사용하여 구성할 수 있습니다. 이 접두사는 URL to connect to, The API Key 등의 속성을 포함합니다. 기본값은 api.minimax.chat(https://api.minimax.chat), Nothing입니다. spring.ai.minimax.base 및 spring.ai.minimax.api-key 속성은 런타임에 요청별 런타임 옵션(#embedding-options)을 임베딩 요청 호출에 추가하여 재정의할 수 있습니다. 또한, spring.ai.minimax.embedding.base 및 spring.ai.minimax.embedding.api-key 속성은 런타임에 요청별 런타임 옵션(#embedding-options)을 임베딩 요청 호출에 추가하여 재정의할 수 있습니다."
"OCI GenAI Embeddings란 무엇인가요?","OCI GenAI Embeddings는 온디맨드 모델 또는 전용 AI 클러스터와 함께 텍스트 임베딩을 제공하는 OCI GenAI 서비스입니다. (출처: https://docs.oracle.com/en-us/iaas/Content/generative-ai/embed-models.htm)"
"Spring AI OCI GenAI Embedding Client의 자동 구성을 사용하려면 어떻게 해야 하나요?","자동 구성을 사용하려면 프로젝트의 Maven pom.xml 또는 Gradle build.gradle 파일에 적절한 의존성을 추가하고 Spring AI BOM을 추가해야 합니다. (출처: https://docs.spring.io/spring-ai/reference/1.0-SNAPSHOT/api/embeddings/oci-genai-embeddings.html)"
"OCI GenAI Embedding Properties는 어떤 역할을 하나요?","OCI GenAI Embedding Properties는 OCI GenAI에 대한 연결을 구성하는 데 사용되며, 인증 유형, 지역, 세입자 ID 및 사용자 ID와 같은 속성을 설정할 수 있습니다. (출처: https://docs.spring.io/spring-ai/reference/1.0-SNAPSHOT/api/embeddings/oci-genai-embeddings.html)"
"올라마 임베딩을 사용하려면 어떤 단계를 거쳐야 하나요?","올라마 임베딩을 사용하려면 먼저 로컬에서 올라마를 실행해야 합니다. 올라마 프로젝트 README(https://github.com/ollama/ollama)를 참조하여 로컬에서 모델을 실행하는 방법을 알아보세요."
"올라마 임베딩 모델의 Spring AI 자동 구성은 어떻게 작동하나요?","올라마 임베딩 모델의 Spring AI 자동 구성은 Maven pom.xml 파일에 다음 종속성을 추가하거나 Gradle build.gradle 빌드 파일에 종속성을 추가하여 활성화할 수 있습니다. Spring AI BOM을 빌드 파일에 추가하려면 Dependency Management(../../getting-started.html#dependency-management) 섹션을 참조하세요. Spring AI 아티팩트는 Spring Milestone 및 Snapshot 저장소에 게시됩니다. 빌드 시스템에 이러한 저장소를 추가하려면 Repositories 섹션을 참조하세요."
"올라마 임베딩 모델의 속성은 무엇인가요?","올라마 임베딩 모델의 속성은 spring.ai.ollama 접두사를 사용하여 구성할 수 있습니다. 이 속성에는 Ollama 임베딩 모델 자동 구성을 활성화하는 spring.ai.ollama.embedding.enabled, 사용할 지원되는 모델의 이름을 지정하는 spring.ai.ollama.embedding.options.model, 모델이 메모리에 로드된 후 유지되는 시간을 제어하는 spring.ai.ollama.embedding.options.keep_alive, 각 입력의 끝을 잘라내어 컨텍스트 길이 내에 맞추는 spring.ai.ollama.embedding.options.truncate 등이 포함됩니다. 나머지 옵션 속성은 Ollama 유효 매개 변수 및 값(https://github.com/ollama/ollama/blob/main/docs/modelfile.md#valid-parameters-and-values) 및 Ollama 유형(https://github.com/ollama/ollama/blob/main/api/types.go)을 기반으로 합니다."
"Spring AI에서 Transformers Embedding Model은 무엇인가요?","선택한 sentence transformer를 사용하여 문장 임베딩을 로컬로 계산하는 EmbeddingModel 구현입니다. HuggingFace Embedding 모델 중 어떤 것이든 사용할 수 있습니다. 이는 Java에서 ONNX 모델을 실행하고 임베딩을 계산하기 위해 미리 훈련된 Transformer 모델을 Open Neural Network Exchange (ONNX) 형식으로 직렬화하여 사용합니다."
"Spring AI에서 ONNX Transformer Embedding Model을 활성화하려면 어떻게 해야 하나요?","프로젝트의 Maven pom.xml 또는 Gradle build.gradle 파일에 spring-ai-transformers-spring-boot-starter 종속성을 추가하여 활성화할 수 있습니다. 또한, spring.ai.embedding.transformer.* 속성을 사용하여 구성할 수 있습니다. 예를 들어, application.properties 파일에 다음을 추가하여 intfloat/e5-small-v2 텍스트 임베딩 모델을 사용하는 클라이언트를 구성할 수 있습니다: spring.ai.embedding.transformer.onnx.modelUri=https://huggingface.co/intfloat/e5-small-v2/resolve/main/model.onnx spring.ai.embedding.transformer.tokenizer.uri=https://huggingface.co/intfloat/e5-small-v2/raw/main/tokenizer.json"
"Spring AI에서 Transformers Embedding Model을 수동으로 구성하려면 어떻게 해야 하나요?","Spring Boot를 사용하지 않는 경우, 수동으로 TransformersEmbeddingModel을 구성할 수 있습니다. 이를 위해 spring-ai-transformers 종속성을 프로젝트의 Maven pom.xml 파일에 추가한 다음, 새로운 TransformersEmbeddingModel 인스턴스를 만들고 setTokenizerResource(tokenizerJsonUri) 및 setModelResource(modelOnnxUri) 메서드를 사용하여 내보낸 tokenizer.json 및 model.onnx 파일의 URI를 설정합니다. (classpath:, file: 또는 https: URI 스키마가 지원됩니다). 모델을 명시적으로 설정하지 않으면 TransformersEmbeddingModel은 sentence-transformers/all-MiniLM-L6-v2(https://huggingface.co/sentence-transformers/all-MiniLM-L6-v2)로 기본 설정됩니다."
"Spring AI에서 PostgresML 텍스트 임베딩 모델을 지원하는 이유는 무엇인가요?","Spring AI는 PostgresML 텍스트 임베딩 모델을 지원하여, 단어와 문장을 숫자 벡터로 표현하여 유사한 텍스트를 찾거나 다른 기계 학습 모델의 입력 특징으로 사용할 수 있습니다. 이는 텍스트를 직접 사용할 수 없는 대부분의 알고리즘에 유용합니다."
"Spring AI 아티팩트는 어떤 저장소에 게시되나요?","Spring AI 아티팩트는 Spring Milestone 및 Snapshot 저장소에 게시됩니다."
"PostgresML 임베딩 모델에 대한 Spring AI의 Spring Boot 자동 구성은 어떻게 사용하나요?","Spring AI의 Spring Boot 자동 구성을 사용하려면 프로젝트의 Maven pom.xml 또는 Gradle build.gradle 파일에 적절한 종속성을 추가하십시오. 그런 다음 spring.ai.postgresml.embedding.options.* 속성을 사용하여 모델에 대한 옵션을 구성하십시오."
"QianFan의 다양한 AI 언어 모델을 Spring AI에서 어떻게 상호작용하고 다국어 대화형 어시스턴트를 만들 수 있나요?","QianFan에서 API를 생성하여 QianFan 언어 모델에 액세스해야 합니다. QianFan 등록 페이지(https://login.bce.baidu.com/new-reg)에서 계정을 만들고 API 키 페이지(https://console.bce.baidu.com/qianfan/ais/console/applicationConsole/application)에서 토큰을 생성하세요. Spring AI 프로젝트는 spring.ai.qianfan.api-key 및 spring.ai.qianfan.secret-key라는 구성 속성을 정의합니다. API 키 페이지(https://console.bce.baidu.com/qianfan/ais/console/applicationConsole/application)에서 얻은 API 키 및 비밀 키의 값으로 설정해야 합니다. 환경 변수를 내보내는 것은 해당 구성 속성을 설정하는 한 가지 방법입니다: export SPRING_AI_QIANFAN_API_KEY=<INSERT KEY HERE>"
"QianFan에서 API를 생성하는 방법은 무엇인가요?","Baidu Cloud(https://console.bce.baidu.com/qianfan/ais/console/applicationConsole/application)에 로그인하고 'API Key' 버튼을 클릭하여 API를 생성할 수 있습니다. 그런 다음 API 키와 비밀 키를 복사하여 Spring AI 프로젝트의 구성 속성으로 사용할 수 있습니다."
"QianFan Embedding Client의 재시도 메커니즘을 구성하려면 어떻게 해야 하나요?","QianFan Embedding 클라이언트의 재시도 메커니즘을 구성하려면 spring.ai.retry 접두사를 사용하여 재시도 속성을 설정할 수 있습니다. 최대 재시도 시도 횟수를 지정하려면 spring.ai.retry.max-attempts 속성을 설정하세요. 지수 백오프 정책의 초기 대기 간격을 지정하려면 spring.ai.retry.backoff.initial-interval 속성을 설정하세요. 백오프 간격 배수를 지정하려면 spring.ai.retry.backoff.multiplier 속성을 설정하세요. 최대 백오프 기간을 지정하려면 spring.ai.retry.backoff.max-interval 속성을 설정하세요. 4xx 클라이언트 오류 코드에 대해 재시도를 시도하지 않고 NonTransientAiException을 throw하려면 spring.ai.retry.on-client-errors 속성을 false로 설정하세요. 재시도를 트리거하지 않아야 하는 HTTP 상태 코드 목록을 지정하려면 spring.ai.retry.exclude-on-http-codes 속성을 설정하세요. 재시도를 트리거해야 하는 HTTP 상태 코드 목록을 지정하려면 spring.ai.retry.on-http-codes 속성을 설정하세요."
"Spring AI의 VertexAI Embedding Model을 Spring Boot 프로젝트에서 사용하려면 어떤 단계를 따라야 하나요?","Spring AI의 VertexAI Embedding Model을 Spring Boot 프로젝트에서 사용하려면, 먼저 gcloud CLI를 설치하고 인증해야 합니다. 그런 다음, 빌드 시스템에 Spring AI 저장소를 추가하고 Spring AI BOM을 추가해야 합니다. 다음으로, Maven 또는 Gradle 의존성을 추가하여 Spring AI의 Spring Boot 자동 구성을 활성화합니다. 마지막으로, application.properties 파일에서 VertexAI Embedding API에 연결하기 위한 속성을 구성합니다."
"Spring AI의 VertexAI Embedding Model에서 어떤 속성을 사용할 수 있나요?","Spring AI의 VertexAI Embedding Model에서는 VertexAI Embedding API에 연결하기 위해 spring.ai.vertex.ai.embedding 속성 접두어를 사용합니다. 이 속성에는 project-id, location, apiEndpoint 등이 포함됩니다. VertexAI Text Embedding에 대한 임베딩 모델 구현을 구성하기 위해 spring.ai.vertex.ai.embedding.text 속성 접두어를 사용합니다. 이 속성에는 enabled, model, task-type 등이 포함됩니다."
"Spring AI의 VertexAI Embedding Model을 수동으로 구성하려면 어떻게 해야 하나요?","Spring AI의 VertexAI Embedding Model을 수동으로 구성하려면, 먼저 프로젝트 ID와 위치를 사용하여 VertexAiEmbeddigConnectionDetails를 생성합니다. 그런 다음, 모델 이름을 사용하여 VertexAiTextEmbeddingOptions를 생성합니다. 마지막으로, VertexAiEmbeddigConnectionDetails와 VertexAiTextEmbeddingOptions를 사용하여 VertexAiTextEmbeddingModel을 생성합니다."
"Google VertexAI Multimodal Embeddings는 어떤 용도로 사용되나요?","이미지, 텍스트 및 비디오 데이터의 조합을 기반으로 1408차원 벡터를 생성하여 이미지 분류 또는 비디오 콘텐츠 조정과 같은 후속 작업에 사용할 수 있습니다."
"Google VertexAI Multimodal Embeddings 모델은 어떤 제한 사항이 있나요?","VertexAI Multimodal API는 요청할 수 있는 동시 작업 수, 작업당 최대 크기 및 요청할 수 있는 최대 요청 수에 제한이 있습니다."
"Google VertexAI Multimodal Embeddings 모델에서 텍스트만 사용하는 경우 어떤 모델을 권장하나요?","Vertex AI 텍스트 임베딩 모델(vertexai-embeddings-text.html)을 사용하는 것이 좋습니다."
"Vertext AI의 PaLM2 임베딩을 사용하는 것이 어떤 경우에 적합한가요?","Vertext AI의 PaLM2 임베딩은 텍스트만 있는 임베딩 사용 사례에 적합합니다."
"PaLM API는 어떤 용도로 사용할 수 있나요?","PaLM API는 코드 생성, 추론, 작성 등 다양한 작업에 뛰어난 결과를 제공하는 PaLM 모델을 사용하여 생성형 AI 애플리케이션을 구축할 수 있습니다."
"PaLM2 REST API에 액세스하려면 어떤 전제 조건이 필요한가요?","PaLM2 REST API에 액세스하려면 makersuite에서 액세스 API KEY를 획득해야 합니다."
"Watsonx.ai를 사용하여 어떻게 임베딩을 생성할 수 있나요?","Watsonx.ai를 사용하여 임베딩을 생성하려면 SaaS 인스턴스와 IBM Cloud 계정이 필요합니다. WatsonxAiEmbeddingModel을 사용하여 Watsonx.ai 텍스트 임베딩을 사용할 수 있습니다. spring.ai.watsonx.embedding.options.* 속성을 사용하여 모든 임베딩 요청에 사용되는 기본 옵션을 구성할 수 있습니다. EmbeddingResponse embeddingResponse = embeddingModel.call(new EmbeddingRequest(List.of('Hello World', 'World is big and salvation is near'), WatsonxAiEmbeddingOptions.create().withModel('Different-Embedding-Model-Deployment-Name'))); Spring AI는 Watsonx.ai 임베딩 모델에 대한 Spring Boot 자동 구성도 제공합니다. - 출처: {https://docs.spring.io/spring-ai/reference/1.0-SNAPSHOT/api/embeddings/watsonx-ai-embeddings.html}"
"Watsonx.ai 임베딩 모델을 사용하려면 어떤 의존성을 추가해야 하나요?","Maven pom.xml 파일에서 <dependency> <groupId>org.springframework.ai</groupId> <artifactId>spring-ai-watsonx-ai-spring-boot-starter</artifactId> </dependency>를 추가하거나 Gradle build.gradle 빌드 파일에서 dependencies { implementation 'org.springframework.ai:spring-ai-watsonx-ai-spring-boot-starter' }를 추가하여 Watsonx.ai 임베딩 모델을 사용할 수 있습니다. Spring AI BOM을 빌드 파일에 추가하여 종속성 관리를 용이하게 할 수 있습니다. - 출처: {https://docs.spring.io/spring-ai/reference/1.0-SNAPSHOT/api/embeddings/watsonx-ai-embeddings.html}"
"임베딩 프로세스 중에 사용될 모델을 구성하려면 어떤 속성을 사용해야 하나요?","임베딩 프로세스 중에 사용될 모델을 구성하기 위해 spring.ai.watsonx.ai.embedding.options.model 속성을 사용할 수 있습니다. default 값은 ibm/slate-30m-english-rtrvr입니다. WatsonxAiEmbeddingOptions.java를 사용하여 이를 구성할 수 있습니다. - 출처: {https://docs.spring.io/spring-ai/reference/1.0-SNAPSHOT/api/embeddings/watsonx-ai-embeddings.html}"
"ZhiPuAI 임베딩은 무엇인가요?","ZhiPuAI의 텍스트 임베딩 모델은 텍스트 문자열의 관련성을 측정합니다. 임베딩은 부동 소수점 숫자의 벡터(리스트)입니다. 두 벡터 간의 거리는 관련성을 측정합니다. 작은 거리는 높은 관련성을 시사하고 큰 거리는 낮은 관련성을 시사합니다."
"ZhiPuAI 임베딩 모델을 사용하려면 어떤 사전 요구 사항이 있나요?","ZhiPuAI와 API를 생성하여 ZhiPuAI 언어 모델에 액세스해야 합니다. ZhiPu AI 등록 페이지(https://open.bigmodel.cn/login)에서 계정을 만들고 API 키 페이지(https://open.bigmodel.cn/usercenter/apikeys)에서 토큰을 생성하세요."
"Spring AI 프로젝트에서 ZhiPuAI 임베딩 모델의 최대 재시도 횟수를 구성하려면 어떻게 해야 하나요?","spring.ai.retry.max-attempts 구성 속성을 사용하여 ZhiPuAI 임베딩 모델의 최대 재시도 횟수를 구성할 수 있습니다. 기본값은 10입니다."
"Azure OpenAI 서비스에서 DALL-E를 사용하려면 Spring AI에서 어떤 구성 속성을 설정해야 하나요?","spring.ai.azure.openai.api-key 및 spring.ai.azure.openai.endpoint"
"Azure AI Deployment를 생성하여 Azure AI 애플리케이션을 사용하는 방법은 무엇인가요?","Azure AI 포털(https://oai.azure.com/portal)을 통해 생성합니다."
"Azure OpenAI Chat Client의 자동 구성을 활성화하려면 Spring Boot 프로젝트에 어떤 종속성을 추가해야 하나요?","<dependency><groupId>org.springframework.ai</groupId><artifactId>spring-ai-azure-openai-spring-boot-starter</artifactId></dependency>"
"Spring AI에서 OpenAI와 연결하기 위해 사용되는 속성 접두사는 무엇인가요?","spring.ai.openai (출처: <https://docs.spring.io/spring-ai/reference/1.0-SNAPSHOT/api/image/openai-image.html>)"
"Spring AI OpenAI Image Generation Client를 활성화하는 방법은 무엇인가요?","프로젝트의 Maven pom.xml 파일에 <dependency> <groupId>org.springframework.ai</groupId> <artifactId>spring-ai-openai-spring-boot-starter</artifactId> </dependency> 또는 Gradle build.gradle 빌드 파일에 dependencies { implementation 'org.springframework.ai:spring-ai-openai-spring-boot-starter' }를 추가하세요. 빌드 파일에 Spring AI BOM을 추가하려면 Dependency Management(../../getting-started.html#dependency-management) 섹션을 참조하세요. (출처: <https://docs.spring.io/spring-ai/reference/1.0-SNAPSHOT/api/image/openai-image.html>)"
"Spring AI OpenAI Image Generation을 위해 설정해야 하는 필수 환경 변수는 무엇인가요?","SPRING_AI_OPENAI_API_KEY (출처: <https://docs.spring.io/spring-ai/reference/1.0-SNAPSHOT/api/image/openai-image.html>)"
"Stability AI와 연동하기 위해 필요한 전제 조건은 무엇인가요?","Stability AI의 AI 모델에 접근하기 위해 API 키를 생성해야 하며, Stability AI의 Getting Started 문서를 따라야 합니다. (출처: https://docs.spring.io/spring-ai/reference/1.0-SNAPSHOT/api/image/stabilityai-image.html)"
"Stability AI Image Generation Client에 대한 Spring AI의 Spring Boot auto-configuration을 활성화하려면 어떻게 해야 하나요?","프로젝트의 Maven pom.xml 또는 Gradle build.gradle 파일에 다음 의존성을 추가하면 됩니다. (출처: https://docs.spring.io/spring-ai/reference/1.0-SNAPSHOT/api/image/stabilityai-image.html)"
"Stability AI의 ImageModel 구현을 구성하기 위한 속성 접두사는 무엇인가요?","spring.ai.stabilityai.image입니다. (출처: https://docs.spring.io/spring-ai/reference/1.0-SNAPSHOT/api/image/stabilityai-image.html)"
"ZhiPuAI를 사용하여 이미지 생성을 지원하는 Spring AI 기능은 무엇인가요?","CogView"
"ZhiPuAI 이미지 모델에 액세스하려면 어떤 사전 요구 사항이 필요한가요?","ZhiPuAI에서 API를 생성해야 합니다."
"Spring AI 프로젝트에서 ZhiPuAI API 키를 설정하는 방법은 무엇인가요?","export SPRING_AI_ZHIPU_AI_API_KEY=<INSERT KEY HERE>"
"QianFan Image Generation을 사용하려면 어떤 사전 요구 사항이 필요한가요?","QianFan Image Generation을 사용하려면 QianFan에서 API를 생성하여 QianFan 언어 모델에 액세스해야 합니다. QianFan 등록 페이지(https://login.bce.baidu.com/new-reg)에서 계정을 만들고 API 키 페이지(https://console.bce.baidu.com/qianfan/ais/console/applicationConsole/application)에서 토큰을 생성해야 합니다."
"Spring AI는 QianFan Image Generation을 어떻게 구성할 수 있나요?","Spring AI는 QianFan Image Generation을 구성하기 위해 spring.ai.qianfan.image 접두사를 사용합니다. 이 접두사를 사용하여 QianFan의 ImageModel 구현을 구성할 수 있는 속성 접두사를 제공합니다."
"QianFan Image Generation을 사용하기 위해 Spring AI에 필요한 종속성은 무엇인가요?","QianFan Image Generation을 사용하기 위해 Spring AI에 필요한 종속성은 spring-ai-qianfan-spring-boot-starter입니다. 이 종속성은 Maven pom.xml 파일 또는 Gradle build.gradle 빌드 파일에 추가하여 프로젝트에 포함시킬 수 있습니다. 또한 Spring AI BOM을 추가하여 프로젝트 전체에서 일관된 버전의 Spring AI를 사용할 수 있도록 해야 합니다."
"Spring AI 프로젝트의 목적은 무엇인가요?","Spring AI 프로젝트는 인공지능 기능을 불필요한 복잡성 없이 통합하는 애플리케이션 개발을 간소화하는 것을 목표로 합니다. (출처: https://docs.spring.io/spring-ai/reference/1.0-SNAPSHOT/index.html#api/audio)"
"Spring AI는 Python 프로젝트인 LangChain과 LlamaIndex와 어떤 관련이 있나요?","Spring AI 프로젝트는 Python 프로젝트인 LangChain과 LlamaIndex에서 영감을 받았지만, 해당 프로젝트들을 직접 이식한 것은 아닙니다. (출처: https://docs.spring.io/spring-ai/reference/1.0-SNAPSHOT/index.html#api/audio)"
"Spring AI는 어떤 AI 모델 제공업체와 벡터 데이터베이스 제공업체를 지원하나요?","Spring AI는 OpenAI, Microsoft, Amazon, Google, Hugging Face와 같은 주요 모델 제공업체와 Apache Cassandra, Azure Vector Search, Chroma, Milvus, MongoDB Atlas, Neo4j, Oracle, PostgreSQL/PGVector, PineCone, Qdrant, Redis, Weaviate와 같은 주요 벡터 데이터베이스 제공업체를 지원합니다. (출처: https://docs.spring.io/spring-ai/reference/1.0-SNAPSHOT/index.html#api/audio)"
"Spring AI는 어떤 Transcription API를 지원하나요?","OpenAI의 Transcription API를 지원합니다. (출처: <https://docs.spring.io/spring-ai/reference/1.0-SNAPSHOT/api/audio/transcriptions.html>)"
"Spring AI에서 다른 Transcription 제공업체를 구현할 때 어떤 일이 발생하나요?","공통 AudioTranscriptionModel 인터페이스가 추출됩니다. (출처: <https://docs.spring.io/spring-ai/reference/1.0-SNAPSHOT/api/audio/transcriptions.html>)"
"Spring AI의 Transcription API에 관련된 추가 제공업체를 어디에서 찾을 수 있나요?","QianFan과 Azure OpenAI는 추가 제공업체입니다. (출처: <https://docs.spring.io/spring-ai/reference/1.0-SNAPSHOT/api/audio/transcriptions.html>)"
"OpenAI Transcriptions를 사용하려면 어떤 사전 요구 사항이 필요한가요?","OpenAI Transcriptions를 사용하려면 OpenAI에서 API 키를 생성하고, 해당 API 키를 spring.ai.openai.api-key 구성 속성에 설정해야 합니다. OpenAI 가입 페이지(https://platform.openai.com/signup)에서 계정을 생성하고, API 키 페이지(https://platform.openai.com/account/api-keys)에서 토큰을 생성할 수 있습니다."
"Spring AI에서 OpenAI Transcription Client에 대한 자동 구성을 사용하려면 어떻게 해야 하나요?","Spring AI에서 OpenAI Transcription Client에 대한 자동 구성을 사용하려면 프로젝트의 Maven pom.xml 파일 또는 Gradle build.gradle build 파일에 spring-ai-openai-spring-boot-starter 종속성을 추가하고, 빌드 파일에 Spring AI BOM을 포함해야 합니다."
"OpenAI Transcription Client를 수동으로 구성하려면 어떻게 해야 하나요?","OpenAI Transcription Client를 수동으로 구성하려면 프로젝트의 Maven pom.xml 파일 또는 Gradle build.gradle build 파일에 spring-ai-openai 종속성을 추가하고, OpenAiAudioApi 및 OpenAiAudioTranscriptionModel 클래스를 사용하여 OpenAI API와 연결하고, OpenAiAudioTranscriptionOptions 클래스를 사용하여 트랜스크립션 옵션을 구성해야 합니다."
"Spring AI는 어떤 TTS(Text-To-Speech) API를 지원하나요?","OpenAI의 Speech API를 지원합니다. (출처: https://docs.spring.io/spring-ai/reference/1.0-SNAPSHOT/api/audio/speech.html)"
"Spring AI는 Speech API를 위해 다른 제공업체와 어떻게 통합될 예정인가요?","추가적인 Speech 제공업체가 구현될 때, 공통의 SpeechModel 및 StreamingSpeechModel 인터페이스가 추출될 예정입니다. (출처: https://docs.spring.io/spring-ai/reference/1.0-SNAPSHOT/api/audio/speech.html)"
"OpenAI의 Speech API에 대한 Spring AI의 문서는 어디에서 찾을 수 있나요?","해당 문서는 다음 링크에서 확인할 수 있습니다: https://docs.spring.io/spring-ai/reference/1.0-SNAPSHOT/api/audio/speech.html"
