"Spring Cloud Contract에서 ToFileContractsTransformer 클래스의 주요 기능은 무엇인가요?","ToFileContractsTransformer 클래스는 주어진 ContractConverter에 대한 계약을 파일로 덤프하는 기능을 제공합니다. (출처: https://docs.spring.io/spring-cloud-contract/reference/htmlsingle/#how-to-generate-from-scc)"
"ToFileContractsTransformer를 실행 가능한 애플리케이션으로 실행하는 방법은 무엇인가요?","ToFileContractsTransformer는 실행 가능한 애플리케이션으로 실행할 수 있는 정적 void main 메소드를 포함하고 있습니다. (출처: https://docs.spring.io/spring-cloud-contract/reference/htmlsingle/#how-to-generate-from-scc)"
"ToFileContractsTransformer의 기본 출력 폴더는 어디인가요?","ToFileContractsTransformer의 기본 출력 폴더는 target/converted-contracts입니다. (출처: https://docs.spring.io/spring-cloud-contract/reference/htmlsingle/#how-to-generate-from-scc)"
"Spring Cloud Contract에서 트랜지티브 의존성을 어떻게 처리할 수 있나요?","Spring Cloud Contract 플러그인은 스텁 jar를 생성하는 작업을 추가합니다. 스텁을 재사용할 때, 해당 스텁의 모든 의존성을 실수로 가져올 수 있는 문제가 발생합니다. Maven 아티팩트를 빌드할 때, 여러 개의 다른 jar 파일이 있더라도 모두 하나의 pom.xml 파일을 공유합니다. 이러한 의존성을 처리하는 세 가지 가능한 방법은 모든 애플리케이션 의존성을 선택적으로 표시하거나, 스텁을 위한 별도의 아티팩트 ID를 생성하거나, 소비자 측에서 의존성을 제외하는 것입니다. (출처: https://docs.spring.io/spring-cloud-contract/reference/htmlsingle/#howto.work-with-transitive-dependencies)"
"Spring Cloud Contract에서 모든 애플리케이션 의존성을 선택적으로 표시하는 방법은 무엇인가요?","프로듀서 애플리케이션에서 모든 의존성을 선택적으로 표시하면, 다른 애플리케이션에서 프로듀서 스텁을 포함할 때 (또는 Stub Runner에서 해당 의존성을 다운로드할 때), 모든 의존성이 선택적이므로 다운로드되지 않습니다. (출처: https://docs.spring.io/spring-cloud-contract/reference/htmlsingle/#howto.work-with-transitive-dependencies)"
"Spring Cloud Contract에서 스텁을 위한 별도의 아티팩트 ID를 생성하는 방법은 무엇인가요?","별도의 아티팩트 ID를 생성하면 원하는 방식으로 설정할 수 있습니다. 예를 들어, 의존성을 전혀 사용하지 않기로 결정할 수 있습니다. (출처: https://docs.spring.io/spring-cloud-contract/reference/htmlsingle/#howto.work-with-transitive-dependencies)"
"Spring REST Docs 스니펫을 계약에서 생성하려면 어떻게 해야 하나요?","Spring REST Docs를 사용하여 API의 요청 및 응답을 포함하려면 MockMvc 및 RestAssuredMockMvc를 사용하는 경우 설정에 약간의 변경만 필요합니다. 이 작업을 수행하려면 다음 종속성을 포함하십시오(이미 수행 한 경우 제외)."
"Spring REST Docs를 사용하여 요청 및 응답을 포함하려면 어떤 종속성이 필요한가요?","Spring REST Docs를 사용하여 API의 요청 및 응답을 포함하려면 다음 종속성을 포함해야 합니다. <dependency> <groupId>org.springframework.cloud</groupId> <artifactId>spring-cloud-starter-contract-verifier</artifactId> <scope>test</scope> </dependency> <dependency> <groupId>org.springframework.restdocs</groupId> <artifactId>spring-restdocs-mockmvc</artifactId> <optional>true</optional> </dependency> testImplementation 'org.springframework.cloud:spring-cloud-starter-contract-verifier' testImplementation 'org.springframework.restdocs:spring-restdocs-mockmvc'"
"Spring REST Docs에서 출력 디렉토리를 지정해야 하나요?","Spring REST Docs의 버전 1.2.0.RELEASE부터는 생성된 스니펫의 출력 디렉토리를 지정할 필요가 없습니다."
"스텁 실행기 또는 Spring Cloud Contract 플러그인에서 리포지토리 루트 인수를 제공할 때, 저장소를 복제하거나 JAR를 가져오지 않고 주어진 위치에서 계약 또는 스텁을 가져오려면 어떤 프로토콜을 사용해야 하나요?","stubs:// 프로토콜을 사용해야 합니다. (출처: https://docs.spring.io/spring-cloud-contract/reference/htmlsingle/#how-to-use-stubs-from-a-location)"
"스텁 실행기를 사용하여 주어진 위치에서 계약 또는 스텁을 가져오는 방법에 대한 자세한 정보는 어디에서 찾을 수 있나요?","문서의 이 섹션(https://docs.spring.io/spring-cloud-contract/reference/htmlsingle/#_using_the_stubs_protocol)에서 확인할 수 있습니다. (출처: https://docs.spring.io/spring-cloud-contract/reference/htmlsingle/#how-to-use-stubs-from-a-location)"
"스텁 실행기에서 리포지토리 루트 인수를 제공할 때, 주어진 위치에서 계약 또는 스텁을 가져오는 프로토콜은 무엇인가요?","stubs:// 프로토콜을 사용해야 합니다. (출처: https://docs.spring.io/spring-cloud-contract/reference/htmlsingle/#how-to-use-stubs-from-a-location)"
"스프링 클라우드 계약에서 런타임에 스텁을 생성하려면 어떻게 해야 하나요?","@AutoConfigureStubRunner 어노테이션의 generateStubs 속성을 전환하거나 JUnit Rule 또는 Extension에서 withGenerateStubs(true) 메서드를 호출하여 런타임에 스텁을 생성할 수 있습니다. 자세한 내용은 다음 문서를 참조하십시오: https://docs.spring.io/spring-cloud-contract/reference/htmlsingle/#project-features-stubrunner-generate-stubs-at-runtime"
"스프링 클라우드 계약에서 런타임에 스텁을 생성하는 데 어떤 속성을 사용해야 하나요?","@AutoConfigureStubRunner 어노테이션의 generateStubs 속성을 전환하거나 JUnit Rule 또는 Extension에서 withGenerateStubs(true) 메서드를 호출하여 런타임에 스텁을 생성할 수 있습니다. 자세한 내용은 다음 문서를 참조하십시오: https://docs.spring.io/spring-cloud-contract/reference/htmlsingle/#project-features-stubrunner-generate-stubs-at-runtime"
"스프링 클라우드 계약에서 런타임에 스텁을 생성하는 데 사용할 수 있는 메서드는 무엇인가요?","JUnit Rule 또는 Extension에서 withGenerateStubs(true) 메서드를 호출하여 런타임에 스텁을 생성할 수 있습니다. 자세한 내용은 다음 문서를 참조하십시오: https://docs.spring.io/spring-cloud-contract/reference/htmlsingle/#project-features-stubrunner-generate-stubs-at-runtime"
"Stub Runner에서 stub이 없을 때 빌드를 통과시키려면 어떻게 해야 하나요?","Stub Runner에서 stub이 없을 때 빌드를 실패시키지 않으려면, @AutoConfigureStubRunner 어노테이션의 generateStubs 속성을 전환하거나 JUnit Rule 또는 Extension의 withFailOnNoStubs(false) 메서드를 호출하십시오. 자세한 내용은 이 섹션(../project-features-stubrunner/stub-runner-fail-on-no-stubs.html)에서 확인할 수 있습니다. (출처: https://docs.spring.io/spring-cloud-contract/reference/html/howto-use-the-failonnostubs-feature.html)"
"Maven에서 contracts가 없을 때 빌드를 실패시키지 않으려면 어떻게 해야 하나요?","Maven에서 contracts가 없을 때 빌드를 실패시키지 않으려면, failOnNoStubs 플래그를 설정하십시오. (출처: https://docs.spring.io/spring-cloud-contract/reference/html/howto-use-the-failonnostubs-feature.html)"
"Gradle에서 contracts가 없을 때 빌드를 실패시키지 않으려면 어떻게 해야 하나요?","Gradle에서 contracts가 없을 때 빌드를 실패시키지 않으려면, contractRepository { failOnNoStubs(false) } 클로저를 호출하십시오. (출처: https://docs.spring.io/spring-cloud-contract/reference/html/howto-use-the-failonnostubs-feature.html)"
"Spring Cloud Contract에서 in-progress contracts를 어떻게 처리하나요?","in-progress contracts를 처리하기 위해 기본적으로 failOnInProgress 플래그를 true로 설정합니다. 그러나 테스트를 생성할 때 이러한 계약을 허용하려면 플래그를 false로 설정할 수 있습니다. 이 정보는 다음 링크에서 확인할 수 있습니다: https://docs.spring.io/spring-cloud-contract/reference/htmlsingle/#_fail_on_in_progress_contracts"
"in-progress contracts가 false positives를 유발하는 이유는 무엇인가요?","in-progress contracts는 프로듀서 측에서 테스트가 생성되지 않고 스텁만 생성되기 때문에 false positives를 유발할 수 있습니다. 이 정보는 다음 링크에서 확인할 수 있습니다: https://docs.spring.io/spring-cloud-contract/reference/htmlsingle/#_in_progress_contracts"
"테스트를 생성할 때 in-progress contracts를 허용하려면 어떻게 해야 하나요?","테스트를 생성할 때 in-progress contracts를 허용하려면 failOnInProgress 플래그를 false로 설정하면 됩니다. 이 정보는 다음 링크에서 확인할 수 있습니다: https://docs.spring.io/spring-cloud-contract/reference/htmlsingle/#_fail_on_in_progress_contracts"
"Spring Cloud Contract를 사용자 정의하는 방법은 무엇인가요?","Spring Cloud Contract의 다양한 부분을 사용자 정의하는 방법에 대해 설명합니다. (출처: https://docs.spring.io/spring-cloud-contract/reference/advanced.html)"
"Spring Cloud Contract를 사용자 정의하는 데 어떤 방법을 사용할 수 있나요?","Spring Cloud Contract의 다양한 부분을 사용자 정의하는 방법에 대해 설명합니다. (출처: https://docs.spring.io/spring-cloud-contract/reference/advanced.html)"
"Spring Cloud Contract에서 사용자 정의할 수 있는 부분은 어떤 것이 있나요?","Spring Cloud Contract의 다양한 부분을 사용자 정의하는 방법에 대해 설명합니다. (출처: https://docs.spring.io/spring-cloud-contract/reference/advanced.html)"
"스프링 클라우드 계약 검증기를 DSL을 확장하여 커스터마이징할 수 있는 경우와 그 조건은 무엇인가요?","그루비 DSL을 사용하는 경우, 스프링 클라우드 계약 검증기를 DSL을 확장하여 커스터마이징할 수 있습니다. DSL을 확장하려면, 정적 호환성을 유지하면서 DSL에 자체 함수를 제공할 수 있습니다. 키 요구 사항은 정적 호환성을 유지하는 것입니다."
"재사용 가능한 클래스를 포함하는 JAR를 만들고 이를 DSL에서 참조하는 방법은 무엇인가요?","재사용 가능한 클래스를 포함하는 JAR를 만들고 이를 DSL에서 참조하려면, 먼저 공통 JAR 종속성을 테스트 종속성으로 추가해야 합니다. 계약 파일이 테스트 리소스 경로에 있으므로, 공통 JAR 클래스는 자동으로 Groovy 파일에서 보이게 됩니다. 예시 코드는 다음 링크에서 확인할 수 있습니다: https://raw.githubusercontent.com/spring-cloud-samples/spring-cloud-contract-samples/main/producer/."
"스프링 클라우드 계약 플러그인의 convertToYaml 속성은 어떤 역할을 하나요?","스프링 클라우드 계약 플러그인의 convertToYaml 속성은 YAML 계약을 사용하도록 설정하는 데 사용됩니다. 이 속성을 true로 설정하면, Groovy 계약 대신 YAML 계약을 사용하는 소비자 측에 확장된 기능을 가진 종속성을 추가하지 않아도 됩니다."
"스프링 클라우드의 ContractConverter 인터페이스는 무엇인가요?","ContractConverter 인터페이스는 다른 형식(YAML, RAML, PACT 등)으로 정의된 계약을 테스트 및 스텁의 자동 생성 이점을 활용할 수 있도록 구현할 수 있습니다. 이 인터페이스를 사용하면 테스트 및 스텁 생성 방식을 사용자 정의할 수도 있습니다. ContractConverter 인터페이스를 구현하려면 변환을 시작해야 하는 조건과 양방향 변환 방법을 정의해야 합니다. 구현을 완료하면 구현의 전체 자격 이름을 제공하는 /META-INF/spring.factories 파일을 만들어야 합니다."
"스프링 클라우드 계약에서 SingleTestGenerator 인터페이스를 사용하는 목적은 무엇인가요?","SingleTestGenerator 인터페이스는 Java 이외의 언어에 대한 테스트를 생성하거나 검증기가 Java 테스트를 빌드하는 방식에 만족하지 않는 경우 자체 구현을 등록할 수 있도록 합니다. 이 인터페이스를 구현하여 테스트를 빌드하고 spring.factories 파일에 등록하여 사용할 수 있습니다."
"스프링 클라우드의 StubGenerator 인터페이스를 사용하여 어떻게 사용자 정의 스텁 생성을 할 수 있나요?","StubGenerator 인터페이스를 사용하여 WireMock 이외의 스텁 서버에 대한 스텁을 생성할 수 있습니다. 제공된 코드를 사용하여 스텁을 변환하고 스텁 매핑을 후처리하는 방법을 정의하여 자체 구현을 만들고 spring.factories 파일에 등록하여 사용할 수 있습니다. 이 인터페이스를 사용하면 단일 DSL에서 WireMock 스텁 및 Pact 파일과 같은 여러 스텁 생성 구현을 제공할 수도 있습니다."
"스프링 클라우드 계약에서 애플리케이션 속성은 어떤 파일과 명령줄 스위치에서 지정할 수 있나요?","애플리케이션 속성은 application.properties 파일, application.yml 파일 또는 명령줄 스위치에서 지정할 수 있습니다. (출처: {https://docs.spring.io/spring-cloud-contract/reference/appendix.html})"
"스프링 클라우드 계약에서 추가 jar 파일은 어떻게 속성을 제공할 수 있나요?","추가 jar 파일은 클래스패스에서 속성을 제공할 수 있습니다. (출처: {https://docs.spring.io/spring-cloud-contract/reference/appendix.html})"
"스프링 클라우드 계약에서 공통 속성은 어디에서 문서화되어 있나요?","공통 스프링 클라우드 계약 속성은 참조 매뉴얼의 부록에 문서화되어 있습니다. (출처: {https://docs.spring.io/spring-cloud-contract/reference/appendix.html})"
"윈도우에서 Spring Cloud Contract를 빌드할 때 Git 저장소의 파일이 윈도우의 최대 파일 경로 제한인 255자를 초과하는 문제를 어떻게 해결할 수 있나요?","이 문제를 해결하려면 core.longPaths 속성을 true로 설정하거나 Spring Cloud Contract 저장소를 복제할 때 core.longPaths=true 옵션을 사용해야 합니다. 이렇게 하려면 git config --system core.longPaths true git clone https://github.com/spring-cloud/spring-cloud-contract.git 명령어를 사용하여 시스템의 모든 사용자에게 적용하거나, git config --global core.longPaths true git clone https://github.com/spring-cloud/spring-cloud-contract.git 명령어를 사용하여 현재 사용자에게만 적용하거나, git clone -c core.longPaths=true https://github.com/spring-cloud/spring-cloud-contract.git 명령어를 사용하여 이 저장소에만 적용할 수 있습니다. 어떤 옵션을 사용하든, IDE에서 필요한 Groovy 플러그인을 모두 설치하여 소스를 올바르게 해결해야 합니다. (출처: https://docs.spring.io/spring-cloud-contract/reference/building.html)"
"Spring Cloud Contract 프로젝트의 폴더 구조는 어떻게 되나요?","Spring Cloud Contract 폴더 구조는 config, docker, samples, scripts, specs, spring-cloud-contract-dependencies, spring-cloud-contract-shade, spring-cloud-contract-starters, spring-cloud-contract-stub-runner, spring-cloud-contract-stub-runner-boot, spring-cloud-contract-tools, spring-cloud-contract-verifier, spring-cloud-contract-wiremock, tests의 상위 폴더로 구성됩니다. 각 상위 폴더의 구체적인 내용은 Spring Cloud Contract Building 문서에서 확인할 수 있습니다. (출처: https://docs.spring.io/spring-cloud-contract/reference/building.html)"
"Spring Cloud Contract의 핵심 기능과 Maven 플러그인을 빌드하려면 어떤 명령어를 사용해야 하나요?","Spring Cloud Contract의 핵심 기능과 Maven 플러그인을 빌드하려면 다음 명령어를 사용하면 됩니다: ./mvnw clean install -P integration. 이 명령어를 실행하면 핵심 기능, Maven 플러그인, Gradle 플러그인이 빌드되고, 독립 실행형 샘플 프로젝트에서 end-to-end 테스트가 실행됩니다. (출처: https://docs.spring.io/spring-cloud-contract/reference/building.html)"
"Spring Cloud Contract의 Stub Runner에서 Consul에 스텁을 등록하려면 어떻게 설정하나요?","Spring Cloud Contract의 Stub Runner에서 Consul에 스텁을 등록하려면, application.properties 파일에 `stubrunner.cloud.consul.enabled=true` 속성을 추가하면 됩니다. (출처: https://docs.spring.io/spring-cloud-contract/reference/configprops.html)"
"Spring Cloud Contract의 Stub Runner에서 HTTP 서버 스텁을 위한 구성 옵션을 변경하려면 어떻게 해야 하나요?","Spring Cloud Contract의 Stub Runner에서 HTTP 서버 스텁을 위한 구성 옵션을 변경하려면, application.properties 파일에 `stubrunner.http-server-stub-configurer` 속성을 추가하면 됩니다. 이 속성을 통해 HTTP 서버 스텁을 위한 다양한 옵션을 구성할 수 있습니다. (출처: https://docs.spring.io/spring-cloud-contract/reference/configprops.html)"
"Spring Cloud Contract의 Stub Runner에서 Kafka 스텁 초기화기를 활성화하려면 어떻게 해야 하나요?","Spring Cloud Contract의 Stub Runner에서 Kafka 스텁 초기화기를 활성화하려면, application.properties 파일에 `stubrunner.kafka.initializer.enabled=true` 속성을 추가하면 됩니다. 이 속성을 통해 Kafka 스텁 초기화기를 활성화할 수 있습니다. (출처: https://docs.spring.io/spring-cloud-contract/reference/configprops.html)"
"YML 스키마 정의에서 Spring Cloud Contract Verifier converter YamlContract의 'request' 속성은 무엇인가요?","YML 스키마 정의에서 Spring Cloud Contract Verifier converter YamlContract의 'request' 속성은 'method', 'url', 'path', 'queryParameters', 'headers', 'cookies', 'body', 'bodyFromFile', 'bodyFromFileAsBytes', 'matchers'와 같은 속성을 가진 객체입니다. (출처: https://docs.spring.io/spring-cloud-contract/reference/html/#yaml-schema)"
"YML 스키마 정의에서 Spring Cloud Contract Verifier converter YamlContract의 'response' 속성은 무엇인가요?","YML 스키마 정의에서 Spring Cloud Contract Verifier converter YamlContract의 'response' 속성은 'status', 'headers', 'cookies', 'body', 'bodyFromFile', 'bodyFromFileAsBytes', 'matchers'와 같은 속성을 가진 객체입니다. (출처: https://docs.spring.io/spring-cloud-contract/reference/html/#yaml-schema)"
"YML 스키마 정의에서 Spring Cloud Contract Verifier converter YamlContract의 'matchers' 속성은 무엇인가요?","YML 스키마 정의에서 Spring Cloud Contract Verifier converter YamlContract의 'matchers' 속성은 'body', 'headers', 'queryParameters', 'cookies'와 같은 속성을 가진 객체입니다. (출처: https://docs.spring.io/spring-cloud-contract/reference/html/#yaml-schema)"
