"스프링 클라우드 계약에서 'stubsPerConsumer' 기능을 활성화하려면 어떻게 해야 하나요?","스프링 클라우드 계약에서 'stubsPerConsumer' 기능을 활성화하려면, 소비자 애플리케이션의 spring.application.name 또는 stubrunner.consumer-name 속성을 관련 소비자의 이름으로 설정하거나, @SpringBootTest 또는 @AutoConfigureStubRunner 어노테이션에서 consumerName 속성을 사용하여 직접 설정할 수 있습니다. 이렇게 설정하면, 해당 소비자의 이름과 일치하는 경로에서 등록된 스텁만 참조할 수 있습니다. 이 기능은 spring.cloud.contract.stubrunner.stubs-per-consumer 속성을 true로 설정하여 활성화할 수 있습니다."
"스프링 클라우드 계약에서 'stubsPerConsumer' 기능을 사용하는 것의 장점은 무엇인가요?","스프링 클라우드 계약에서 'stubsPerConsumer' 기능을 사용하면 몇 가지 장점이 있습니다. 이 기능을 사용하면 각 소비자가 해당 소비자의 계약에 따라 다른 스텁을 사용할 수 있으므로, 여러 소비자를 가진 API를 다룰 때 유용합니다. 또한, API가 생성하는 응답의 일부를 제거하고 자동으로 생성된 테스트 중 어떤 것이 실패하는지 확인할 수 있습니다. 실패하는 테스트가 없다면, 해당 부분을 안전하게 삭제할 수 있습니다. 이 기능은 또한 API의 어떤 부분이 사용되고 있는지 명확하게 파악할 수 있도록 도와줍니다. 이 기능을 사용하면 계약의 적절한 패키징을 수행하고, 스텁을 사용하여 이점을 얻을 수 있습니다."
"Spring Cloud Contract의 Stub Runner에서 기본 동작은 무엇인가요?","Spring Cloud Contract의 Stub Runner에서 기본 동작은 stubs를 찾을 수 없는 경우 테스트를 실패시키는 것입니다. (출처: https://docs.spring.io/spring-cloud-contract/reference/html/project-features-stubrunner.html#stubrunner-fail-on-no-stubs)"
"Stub Runner의 fail-on-no-stubs 동작을 비활성화하는 방법은 무엇인가요?","Annotation에서 failOnNoStubs 속성을 false로 설정하거나 JUnit Rule 또는 Extension에서 withFailOnNoStubs(false) 메서드를 호출하여 fail-on-no-stubs 동작을 비활성화할 수 있습니다. (출처: https://docs.spring.io/spring-cloud-contract/reference/html/project-features-stubrunner.html#stubrunner-fail-on-no-stubs)"
"JUnit 4에서 Stub Runner의 fail-on-no-stubs 동작을 비활성화하는 방법은 무엇인가요?","JUnit 4 Rule에서 StubRunnerRule 클래스를 사용하고 withFailOnNoStubs(false) 메서드를 호출하여 fail-on-no-stubs 동작을 비활성화할 수 있습니다. (출처: https://docs.spring.io/spring-cloud-contract/reference/html/project-features-stubrunner.html#stubrunner-fail-on-no-stubs)"
"스텁 런너의 공통 속성 중 어떤 것들이 있고, 어떤 역할을 하나요?","스텁 런너의 공통 속성으로는 `stubrunner.minPort`, `stubrunner.maxPort`, `stubrunner.repositoryRoot`, `stubrunner.classifier`, `stubrunner.stubsMode`, `stubrunner.ids`, `stubrunner.username`, `stubrunner.password`, `stubrunner.stubsPerConsumer`, `stubrunner.consumerName`이 있습니다. 이들은 스텁 런너를 설정하고, 스텁을 다운로드하고 등록하는 방식에 영향을 줍니다. 자세한 내용은 https://docs.spring.io/spring-cloud-contract/reference/project-features-stubrunner/stub-runner-common.html을 참조하세요."
"스텁 런너의 `stubrunner.ids` 속성은 어떤 역할을 하며, 어떤 형식으로 사용해야 하나요?","`stubrunner.ids` 속성은 다운로드할 스텁을 설정하는 데 사용됩니다. 이 속성은 `groupId:artifactId:version:classifier:port` 형식을 따르며, `version`, `classifier`, `port`는 선택 사항입니다. `port`를 제공하지 않으면 임의의 포트가 선택됩니다. `classifier`를 제공하지 않으면 기본값이 사용됩니다. `version`을 제공하지 않으면 `+`가 전달되어 최신 버전이 다운로드됩니다. `port`는 WireMock 서버의 포트를 나타냅니다. 자세한 내용은 https://docs.spring.io/spring-cloud-contract/reference/project-features-stubrunner/stub-runner-common.html을 참조하세요."
"스텁 런너의 `stubrunner.stubsPerConsumer` 속성은 어떤 역할을 하며, 어떻게 사용하나요?","`stubrunner.stubsPerConsumer` 속성은 각 소비자에 대해 다른 스텁을 사용하려는 경우 `true`로 설정하면 됩니다. 이 속성을 사용하면 모든 소비자에 대해 모든 스텁을 등록하는 대신 각 소비자에 대해 다른 스텁을 사용할 수 있습니다. 자세한 내용은 https://docs.spring.io/spring-cloud-contract/reference/project-features-stubrunner/stub-runner-common.html을 참조하세요."
"WireMock은 어떻게 Spring Boot 애플리케이션에서 사용될 수 있나요?","Spring Cloud Contract WireMock 모듈을 사용하여 WireMock을 Spring Boot 애플리케이션에서 사용할 수 있습니다. 이를 위해 spring-cloud-starter-contract-stub-runner를 클래스패스에 추가하고 테스트에서 @AutoConfigureWireMock을 사용하면 됩니다. Wiremock은 스텁 서버로 실행되며, Java API 또는 정적 JSON 선언을 사용하여 스텁 동작을 등록할 수 있습니다."
"WireMock 스텁은 어떻게 자동으로 등록되나요?","WireMock은 기본적으로 파일 시스템이나 클래스패스(file:src/test/resources/mappings)에서 JSON 스텁을 등록합니다. 이는 스텁 속성을 사용하여 사용자 정의할 수 있으며, 이는 Ant 스타일 리소스 패턴 또는 디렉토리일 수 있습니다. 디렉토리의 경우 */.json이 추가됩니다. 또한, 스텁을 로드하는 위치를 사용자 정의할 수 있습니다."
"WireMock의 SSL 유효성 검사를 어떻게 무시할 수 있나요?","WireMock은 스텁 서버를 안전하게 만들기 위해 HTTPS URL 프로토콜을 사용할 수 있습니다. 그러나 SSL 인증서가 유효하지 않은 경우, 클라이언트를 HTTP를 사용하도록 다시 구성하거나 Spring에게 SSL 유효성 검사 오류를 무시하도록 HTTP 클라이언트를 구성하도록 요청할 수 있습니다. 이는 물론 테스트 전용으로 수행되어야 합니다."
"Spring Cloud Contract의 Docker 이미지는 무엇이며, 어떤 기능을 실행하나요?","Spring Cloud Contract의 Docker 이미지는 테스트를 생성하고 실행하는 프로젝트를 포함한 springcloud/spring-cloud-contract 이미지를 게시합니다. 이 이미지는 EXPLICIT 모드에서 테스트를 실행하며, 이는 테스트가 모의된 요청이 아닌 실제 요청을 보낸다는 것을 의미합니다. 또한, 이 프로젝트는 Stub Runner의 독립 실행형 버전을 시작하는 spring-cloud/spring-cloud-contract-stub-runner Docker 이미지도 게시합니다."
"Artifact Manager란 무엇인가요?","Artifact Manager는 바이너리, 소스 또는 패키지를 저장하여 다른 사람들이 다운로드, 참조 또는 재사용할 수 있도록 하는 곳입니다. 예를 들어, JVM 세계의 경우 이러한 아티팩트는 일반적으로 JAR입니다."
"Spring Cloud Contract에서 JAR란 무엇인가요?","Spring Cloud Contract는 JAR 파일에 계약 및 생성된 스텁을 패키징합니다. JAR는 Java ARchive의 약자로, 형식은 ZIP 파일 형식을 기반으로 합니다."
"Gradle Project에서 Spring Cloud Contract Verifier와 WireMock을 사용하려면 어떤 플러그인을 사용해야 하나요?","Gradle 또는 Maven 플러그인을 사용해야 합니다."
"Gradle 플러그인에 종속성을 추가하려면 어떤 코드를 사용해야 하나요?","Plugin DSL GA versions Plugin DSL non GA versions Legacy Plugin Application // build.gradle plugins { id 'groovy' // this will work only for GA versions of Spring Cloud Contract id 'org.springframework.cloud.contract' version '${GAVerifierVersion}' } dependencyManagement { imports { mavenBom 'org.springframework.cloud:spring-cloud-contract-dependencies:${GAVerifierVersion}' } } dependencies { testImplementation 'org.apache.groovy:groovy-all:${groovyVersion}' // example with adding Spock core and Spock Spring testImplementation 'org.spockframework:spock-core:${spockVersion}' testImplementation 'org.spockframework:spock-spring:${spockVersion}' testImplementation 'org.springframework.cloud:spring-cloud-starter-contract-verifier' } // settings.gradle pluginManagement { plugins { id 'org.springframework.cloud.contract' version '${verifierVersion}' } repositories { // to pick from local .m2 mavenLocal() // for snapshots maven { https://docs.spring.io/spring-cloud-contract/reference/gradle-project.html 'https://repo.spring.io/snapshot' } // for milestones maven { https://docs.spring.io/spring-cloud-contract/reference/gradle-project.html 'https://repo.spring.io/milestone' } // for GA versions gradlePluginPortal() } } // build.gradle plugins { id 'groovy' id 'org.springframework.cloud.contract' } dependencyManagement { imports { mavenBom 'org.springframework.cloud:spring-cloud-contract-dependencies:${verifier_version}' } } dependencies { testImplementation 'org.apache.groovy:groovy-all:${groovyVersion}' // example with adding Spock core and Spock Spring testImplementation 'org.spockframework:spock-core:${spockVersion}' testImplementation 'org.spockframework:spock-spring:${spockVersion}' testImplementation 'org.springframework.cloud:spring-cloud-starter-contract-verifier' }"
"Spring Cloud Contract를 사용하는 이유는 무엇인가요?","Spring Cloud Contract는 다양한 언어와 프레임워크를 사용하는 환경에서 소비자 주도 계약(CDC)을 생성하고 검증하는 데 도움이 됩니다. 메시징을 통한 CDC, 명확하고 사용하기 쉬운 정적 유형 DSL, JSON 파일의 요소만 편집하여 계약을 생성하는 기능, 테스트 자동 생성, Stub Runner 기능, Spring Cloud와의 통합, Docker를 통한 언어와 프레임워크 지원 추가 등의 흥미로운 기능을 제공합니다. (출처: https://docs.spring.io/spring-cloud-contract/reference/htmlsingle/)"
"Spring Cloud Contract Verifier의 어떤 기능이 시장에서 돋보이는가요?","Spring Cloud Contract Verifier는 메시징을 통한 CDC, 명확하고 사용하기 쉬운 정적 유형 DSL, JSON 파일의 요소만 편집하여 계약을 생성하는 기능, 테스트 자동 생성, Stub Runner 기능 등의 기능으로 시장에서 돋보입니다. 이러한 기능들은 소비자 주도 계약(CDC) 도구 시장에서 Spring Cloud Contract Verifier를 독특하게 만들어줍니다. (출처: https://docs.spring.io/spring-cloud-contract/reference/htmlsingle/)"
"Spring Cloud Contract의 Stub Runner 기능은 어떤 역할을 하나요?","Spring Cloud Contract의 Stub Runner 기능은 Nexus 또는 Artifactory에서 런타임에 자동으로 스텁을 다운로드합니다. 이를 통해 통합 테스트에 필요한 발견 서비스 없이 스텁을 사용할 수 있습니다. 이 기능은 폴리글랏 환경에서 소비자 주도 계약(CDC)을 생성하고 검증하는 데 도움이 됩니다. (출처: https://docs.spring.io/spring-cloud-contract/reference/htmlsingle/)"
"Spring Cloud Contract에서 Groovy가 아닌 다른 언어로 계약을 작성하려면 어떤 방법이 있나요?","YAML로 계약을 작성할 수 있습니다. 자세한 내용은 이 섹션(../project-features-contract.html)을 참조하세요. 더 많은 계약 설명 방법을 허용하기 위해 노력하고 있으며, 자세한 내용은 github-issues(https://github.com/spring-cloud/spring-cloud-contract/issues/)를 확인할 수 있습니다. (출처: https://docs.spring.io/spring-cloud-contract/reference/htmlsingle/#how-to-not-write-contracts-in-groovy)"
"Spring Cloud Contract에서 YAML로 작성된 계약의 예시를 볼 수 있는 곳은 어디인가요?","YAML로 작성된 계약의 예시는 제공된 정보에서 명시되어 있지 않습니다. 그러나 이 섹션(../project-features-contract.html)에서 자세한 내용을 확인할 수 있으며, 더 많은 계약 설명 방법을 허용하기 위해 노력하고 있으며, 자세한 내용은 github-issues(https://github.com/spring-cloud/spring-cloud-contract/issues/)를 확인할 수 있습니다. (출처: https://docs.spring.io/spring-cloud-contract/reference/htmlsingle/#how-to-not-write-contracts-in-groovy)"
"Spring Cloud Contract에서 계약 설명 방법을 확장하기 위한 계획은 어떻게 되나요?","더 많은 계약 설명 방법을 허용하기 위해 노력하고 있으며, 자세한 내용은 github-issues(https://github.com/spring-cloud/spring-cloud-contract/issues/)를 확인할 수 있습니다. (출처: https://docs.spring.io/spring-cloud-contract/reference/htmlsingle/#how-to-not-write-contracts-in-groovy)"
"스텁의 재사용성과 관련된 가장 큰 도전은 무엇인가요?","스텁의 재사용성과 관련된 가장 큰 도전은 요청 및 응답 요소의 하드코딩된 값(예: 날짜 및 ID)으로 인해 일반적으로 어렵다는 것입니다. 이는 시스템의 시계를 변경하거나 데이터 제공 업체의 스텁 구현을 제공하는 등 프로듀서 측에서 적절한 값을 설정하는 데 필요한 고통을 상상해보십시오."
"소비자가 어떤 형태의 시간 또는 UUID와 일치하는 요청을 보내고자 하는 이유는 무엇인가요?","소비자가 어떤 형태의 시간 또는 UUID와 일치하는 요청을 보내고자 하는 이유는 자신의 시스템이 평소처럼 데이터를 생성하도록 하면서 스텁을 출현시키지 않아도 되기 때문입니다. 이를 통해 다른 필드에 대한 일치를 제공하고 가장 중요한 부분인 본문 필드에 집중할 수 있습니다."
"프로듀서의 측면에서 실제 요청을 엔드포인트로 보내려면 어떻게 해야 하나요?","프로듀서의 측면에서 실제 요청을 엔드포인트로 보내려면 제공된 계약을 구문 분석하고 테스트에서 프로듀서의 백엔드에서 작동할 수 있는 실제 값을 가진 요청을 보내야 합니다. 따라서 요청의 경우 프로듀서의 측면에서 일치하는 것은 가질 수 없으며 프로듀서의 백엔드에서 작동할 수 있는 실제 값이 필요합니다."
"스텁 버전 관리를 위한 API 버전 관리 방식은 무엇인가요?","스텁 버전 관리를 위한 API 버전 관리 방식은 하이퍼미디어 링크를 사용하여 API 버전을 지정하지 않거나, 헤더와 URL을 통해 버전을 전달하거나, 두 가지 접근 방식을 조합하는 것입니다. 어떤 방식이 더 나은지는 상황에 따라 다르며, 비즈니스 가치를 창출하는 데 도움이 되는 방식을 선택해야 합니다. API 버전 관리를 하는 경우, 지원하는 모든 버전에 대한 계약을 제공해야 합니다. 버전 폴더를 생성하거나 계약 이름에 버전을 추가할 수 있습니다. (출처: <https://docs.spring.io/spring-cloud-contract/reference/html/howto.html#how-to-do-stubs-versioning>)"
"스텁을 포함하는 JAR의 버전 관리를 JAR 버전 관리를 통해 수행하는 방법은 무엇인가요?","스텁을 포함하는 JAR의 버전 관리를 JAR 버전 관리를 통해 수행하는 방법은 두 가지 주요 접근 방식이 있습니다. 지속적인 빌드 및 배포를 하는 경우, 파이프라인을 통과할 때마다 새로운 JAR 버전이 생성되고 언제든지 프로덕션에 배포될 수 있습니다. JAR 버전에는 빌드된 날짜와 시간이 포함됩니다. 이 경우, 생성된 스텁 JAR은 다음과 같이 표시되어야 합니다: 1.0.0.20161020-201521-RELEASE-stubs.jar 애플리케이션.yml 파일이나 @AutoConfigureStubRunner를 사용하여 스텁을 참조할 때, 최신 버전의 스텁을 + 기호를 사용하여 참조해야 합니다. 버전 관리가 고정된 경우, jar 버전의 구체적인 값을 설정해야 합니다. (출처: <https://docs.spring.io/spring-cloud-contract/reference/html/howto.html#how-to-do-stubs-versioning>)"
"개발 또는 프로덕션 스텁을 사용하여 테스트를 실행하는 방법은 무엇인가요?","클래스파이어를 조작하여 다른 서비스의 현재 개발 버전 또는 프로덕션에 배포된 스텁을 사용하여 테스트를 실행할 수 있습니다. 스텁을 프로덕션 배포에 도달하면 prod-stubs 클래스파이어로 배포하도록 빌드를 수정합니다. + 기호를 사용하여 애플리케이션.yml 파일이나 @AutoConfigureStubRunner를 사용하여 최신 버전의 스텁을 참조하거나, 배포 파이프라인에서 속성을 사용하여 이러한 값을 전달할 수 있습니다. (출처: <https://docs.spring.io/spring-cloud-contract/reference/html/howto.html#how-to-do-stubs-versioning>)"
"Spring Cloud Contract에서 Git을 사용하여 계약 및 스텁을 저장하는 방법은 무엇인가요?","Spring Cloud Contract 버전 2.0.0 이상부터 SCM(Source Control Management) 저장소에서 계약 및 스텁을 저장할 수 있는 메커니즘을 제공합니다. 현재 지원되는 유일한 SCM은 Git입니다. 저장소는 다음 설정을 가져야 합니다: {https://github.com/spring-cloud-samples/spring-cloud-contract-samples/tree/main/contracts_git/}. META-INF 폴더 아래에서 애플리케이션은 groupId(예: com.example)로 그룹화됩니다. 각 애플리케이션은 artifactId(예: beer-api-producer-git)로 표시됩니다. 그런 다음 각 애플리케이션은 버전(예: 0.0.1-SNAPSHOT)으로 구성됩니다. Spring Cloud Contract 버전 2.1.0 이상부터 다음과 같이 버전을 지정할 수 있습니다: 최신 버전의 스텁을 찾으려면 + 또는 latest를 사용하십시오. 릴리스 버전의 스텁을 찾으려면 release를 사용하십시오. 마지막으로, contracts 및 mappings 두 개의 폴더가 있습니다. 좋은 방법은 각 소비자가 필요로하는 계약을 consumer name(예: beer-api-consumer) 폴더에 저장하는 것입니다. 이렇게하면 stub-per-consumer 기능을 사용할 수 있습니다. 추가 디렉토리 구조는 임의적입니다. Maven 또는 Gradle Spring Cloud Contract 플러그인은이 폴더에 스텁 서버 매핑을 푸시합니다. 소비자 측에서 Stub Runner는이 폴더를 스캔하여 스텁 정의가있는 스텁 서버를 시작합니다. 폴더 구조는 contracts 하위 폴더에서 생성 된 것과 동일합니다. URL의 프로토콜을 사용하여 계약의 소스 유형 및 위치(이진 저장소 또는 SCM 저장소)를 제어할 수 있습니다. Spring Cloud Contract는 등록된 프로토콜 해결자를 반복하고 계약을 가져오려고 시도합니다(플러그인을 사용하여) 또는 스텁(Stub Runner에서). SCM 기능의 경우 현재 Git 저장소를 지원합니다. 사용하려면 저장소 URL의 프로토콜에서 git://으로 접두사를 지정해야합니다. 다음 목록은 몇 가지 예제를 보여줍니다: git://file:///foo/bar, git://https://github.com/spring-cloud-samples/spring-cloud-contract-nodejs-contracts-git.git, git:// [email protected](/cdn-cgi/l/email-protection) :spring-cloud-samples/spring-cloud-contract-nodejs-contracts-git.git"
"Spring Cloud Contract에서 SCM 저장소에서 계약을 가져오는 방법은 무엇인가요?","Spring Cloud Contract에서 SCM 저장소에서 계약을 가져오려면 @AutoConfigureStubRunner 어노테이션, JUnit 4 규칙, JUnit 5 확장 또는 속성에서 repositoryRoot 매개 변수를 전달할 때 git:// 프로토콜로 접두사가 지정된 SCM 저장소의 URL을 전달할 수 있습니다. git 프로젝트는 임시 디렉토리에 복제됩니다. SCM 스텁 다운로더는 META-INF/groupId/artifactId/version/ 폴더로 이동하여 스텁 정의를 찾고 계약을 찾습니다. 예를 들어 com.example:foo:1.0.0의 경우 경로는 META-INF/com.example/foo/1.0.0/입니다. 스텁 서버가 시작되고 매핑이 공급됩니다. 메시징 정의가 읽히고 메시징 테스트에 사용됩니다."
"Spring Cloud Contract에서 프로듀서에서 계약을 유지하고 스텁을 외부 저장소에 유지하는 방법은 무엇인가요?","프로듀서 저장소에 계약을 유지하고 스텁을 외부 git 저장소에 유지하려면 일반적인 프로듀서 설정을 사용한 다음 pushStubsToScm 목표를 추가하고 contractsRepositoryUrl을 스텁을 유지하려는 저장소로 설정하십시오."
"Spring Boot 애플리케이션에서 RestAssured를 사용하여 생성된 테스트 클라이언트가 보내는 요청/응답을 어떻게 디버그할 수 있나요?","Spring Boot 애플리케이션에서 RestAssured를 사용하여 생성된 테스트 클라이언트가 보내는 요청/응답을 디버그하려면, Apache HttpClient의 wire logging 기능을 사용할 수 있습니다. 이를 활성화하려면 application.properties 파일에 다음을 추가하세요: logging.level.org.apache.http.wire=DEBUG. 이렇게 하면 HttpClient를 통해 전송되는 전체 요청 및 응답이 로깅되어 디버깅에 도움이 됩니다. (출처: https://docs.spring.io/spring-cloud-contract/reference/howto/how-to-debug.html)"
"Spring Boot 애플리케이션에서 RestAssured와 관련된 문제를 어떻게 해결할 수 있나요?","Spring Boot 애플리케이션에서 RestAssured와 관련된 문제를 해결하기 위해 wire logging을 사용할 수 있습니다. 이를 위해 application.properties 파일에 logging.level.org.apache.http.wire=DEBUG를 추가하면 됩니다. 이렇게 하면 요청과 응답이 디스크에 기록되어 문제를 식별하고 디버깅하는 데 도움이 됩니다. (출처: https://docs.spring.io/spring-cloud-contract/reference/howto/how-to-debug.html)"
"Spring Boot 애플리케이션에서 RestAssured를 사용하여 생성된 테스트 클라이언트의 디버깅 레벨을 어떻게 설정할 수 있나요?","Spring Boot 애플리케이션에서 RestAssured를 사용하여 생성된 테스트 클라이언트의 디버깅 레벨을 설정하려면, application.properties 파일에 logging.level.org.apache.http.wire=DEBUG를 추가하세요. 이렇게 하면 HttpClient를 통해 전송되는 전체 요청 및 응답이 로깅되어 디버깅에 도움이 됩니다. (출처: https://docs.spring.io/spring-cloud-contract/reference/howto/how-to-debug.html)"
"WireMock에서 전송되는 매핑, 요청 또는 응답을 디버그하는 방법은 무엇인가요?","WireMock의 로깅을 info로 설정하고 WireMock notifier를 verbose로 설정하면, WireMock 서버에서 수신된 요청과 일치하는 응답 정의가 정확히 어떤 것인지 알 수 있습니다. 이 기능을 끄려면, logging.level.com.github.tomakehurst.wiremock=ERROR와 같이 WireMock 로깅을 ERROR로 설정하세요. (출처: https://docs.spring.io/spring-cloud-contract/reference/howto/how-to-debug-wiremock.html)"
"WireMock 로깅을 info로 설정하려면 어떻게 해야 하나요?","logging.level.com.github.tomakehurst.wiremock=INFO와 같이 설정하면 WireMock 로깅이 info로 설정됩니다. (출처: https://docs.spring.io/spring-cloud-contract/reference/howto/how-to-debug-wiremock.html)"
"WireMock에서 수신된 요청과 일치하는 응답 정의를 어떻게 알 수 있나요?","WireMock의 로깅을 info로 설정하고 WireMock notifier를 verbose로 설정하면, 어떤 요청이 수신되었는지와 어떤 일치하는 응답 정의가 선택되었는지 정확히 알 수 있습니다. (출처: https://docs.spring.io/spring-cloud-contract/reference/howto/how-to-debug-wiremock.html)"
"@AutoConfigureStubRunner, StubRunnerRule, 또는 StubRunnerExtension에서 mappingsOutputFolder 속성을 사용하여 각 artifact ID의 모든 매핑을 덤프하는 방법은 무엇인가요?","https://docs.spring.io/spring-cloud-contract/reference/howto/how-to-see-registered-stubs.html에서 확인할 수 있습니다."
"HTTP 서버 스텁에서 등록된 내용을 확인하는 방법은 무엇인가요?","https://docs.spring.io/spring-cloud-contract/reference/howto/how-to-see-registered-stubs.html에서 확인할 수 있습니다."
"HTTP 서버 스텁에서 등록된 내용을 확인하는 데 사용할 수 있는 속성은 무엇인가요?","https://docs.spring.io/spring-cloud-contract/reference/howto/how-to-see-registered-stubs.html에서 확인할 수 있습니다."
"Spring Cloud Contract에서 버전 1.2.0에서 어떤 기능이 추가되었나요?","파일에서 텍스트를 참조하는 기능이 추가되었습니다. DSL에서 file(…​) 메서드를 호출하고 계약이 위치한 곳에서 상대적인 경로를 제공하면 됩니다. YAML을 사용하는 경우 bodyFromFile 속성을 사용할 수 있습니다. (출처: https://docs.spring.io/spring-cloud-contract/reference/htmlsingle/)"
"Spring Cloud Contract에서 YAML을 사용하여 파일에서 텍스트를 참조하는 방법은 무엇인가요?","bodyFromFile 속성을 사용하면 됩니다. (출처: https://docs.spring.io/spring-cloud-contract/reference/htmlsingle/)"
"Spring Cloud Contract에서 파일에서 텍스트를 참조할 때 file(…​) 메서드를 사용하는 방법은 무엇인가요?","DSL에서 file(…​) 메서드를 호출하고 계약이 위치한 곳에서 상대적인 경로를 제공하면 됩니다. (출처: https://docs.spring.io/spring-cloud-contract/reference/htmlsingle/)"
