"How do I use Kotlin extensions in my Spring Data Kotlin code?","To use Kotlin extensions in your Spring Data Kotlin code, you need to import them. Similar to static imports, an IDE should automatically suggest the import in most cases. (Source: https://docs.spring.io/spring-data/commons/reference/3.3/kotlin/extensions.html)"
"What are Kotlin Coroutines and how do they help in writing non-blocking code?","Kotlin Coroutines are instances of suspendable computations that allow developers to write non-blocking code imperatively. They provide an abstraction for asynchronous operations and are supported by the kotlinx.coroutines library. The library offers functions like async { } and types like Flow. Spring Data modules provide support for Coroutines on the Deferred and Flow return values, and this support is enabled when kotlinx-coroutines-core, kotlinx-coroutines-reactive, and kotlinx-coroutines-reactor dependencies are in the classpath. Supported versions are 1.3.0 and above. (Source: https://docs.spring.io/spring-data/commons/reference/3.3/kotlin/coroutines.html)"
"How does the translation from Reactive to Coroutines APIs work for return values?","The translation from Reactive to Coroutines APIs for return values is as follows: fun handler(): Mono<Void> becomes suspend fun handler(), fun handler(): Mono<T> becomes suspend fun handler(): T or suspend fun handler(): T? depending on if the Mono can be empty or not, and fun handler(): Flux<T> becomes fun handler(): Flow<T>. Flow is the equivalent of Flux in the Coroutines world and is suitable for hot or cold streams, finite or infinite streams. Flow has only a single suspending collect method, and operators are implemented as extensions. Operators are easy to implement thanks to Coroutines, and extensions allow adding custom operators to Flow. Collect operations are suspending functions, and the map operator supports asynchronous operation since it takes a suspending function parameter. (Source: https://docs.spring.io/spring-data/commons/reference/3.3/kotlin/coroutines.html)"
"What is the difference between Flow and Flux in terms of how backpressure is implemented?","Backpressure is implemented via suspending functions in Flow, while Flux uses a push-pull hybrid approach. Flow has only a single suspending collect method, and operators are implemented as extensions. Operators are easy to implement thanks to Coroutines. (Source: https://docs.spring.io/spring-data/commons/reference/3.3/kotlin/coroutines.html)"
"What is the purpose of the <repositories /> element in Spring Data?","The <repositories /> element triggers the setup of the Spring Data repository infrastructure. (Source: https://docs.spring.io/spring-data/commons/reference/3.3/repositories/namespace-reference.html)"
"What is the significance of the base-package attribute in the <repositories /> element?","The base-package attribute defines the package to scan for Spring Data repository interfaces that extend *Repository (the actual interface is determined by the specific Spring Data module) in auto-detection mode. All packages below the configured package are scanned, too. Wildcards are allowed. (Source: https://docs.spring.io/spring-data/commons/reference/3.3/repositories/namespace-reference.html)"
"What is the default value for the query-lookup-strategy attribute in the <repositories /> element?","The default value for the query-lookup-strategy attribute is create-if-not-found. This attribute determines the strategy to be used to create finder queries. (Source: https://docs.spring.io/spring-data/commons/reference/3.3/repositories/namespace-reference.html)"
"What is the purpose of the <populator /> element in Spring Data?","The <populator /> element allows to populate a data store via the Spring Data repository infrastructure. (Source: https://docs.spring.io/spring-data/commons/reference/3.3/repositories/populator-namespace-reference.html)"
"What is the attribute used to specify the locations of files to read objects from the repository in the <populator /> element?","The attribute used to specify the locations of files to read objects from the repository in the <populator /> element is 'locations'. (Source: https://docs.spring.io/spring-data/commons/reference/3.3/repositories/populator-namespace-reference.html)"
"Where can I find more information about XML Configuration for creating instances with Spring Data repositories?","You can find more information about XML Configuration for creating instances with Spring Data repositories in the Spring Data Commons Reference Guide, section 'XML Configuration' (create-instances.html#repositories.create-instances.xml). (Source: https://docs.spring.io/spring-data/commons/reference/3.3/repositories/populator-namespace-reference.html)"
"What is the general query method in Spring Data repository query derivation mechanism?","The general query method in Spring Data repository query derivation mechanism is find…By, read…By, get…By, query…By, search…By, and stream…By. These methods typically return the repository type, a Collection or Streamable subtype, or a result wrapper such as Page, GeoResults, or any other store-specific result wrapper. (Source: https://docs.spring.io/spring-data/commons/reference/3.3/repositories/query-keywords-reference.html)"
"What is the keyword used for case-insensitive comparison in Spring Data repository query derivation mechanism?","The keyword used for case-insensitive comparison in Spring Data repository query derivation mechanism is IgnoreCase or IgnoringCase. (Source: https://docs.spring.io/spring-data/commons/reference/3.3/repositories/query-keywords-reference.html)"
"What is the keyword used to specify a static sorting order in Spring Data repository query derivation mechanism?","The keyword used to specify a static sorting order in Spring Data repository query derivation mechanism is OrderBy…, followed by the property path and direction. For example, OrderByFirstnameAscLastnameDesc. (Source: https://docs.spring.io/spring-data/commons/reference/3.3/repositories/query-keywords-reference.html)"
"What is the return type for a Spring Data repository method that expects to return one result at most, and returns null if no result is found?","Optional<T> (Source: https://docs.spring.io/spring-data/commons/reference/3.3/repositories/query-return-types-reference.html)"
"What is the return type for a Spring Data repository method that returns a sized chunk of data with an indication of whether there is more data available?","Slice<T> (Source: https://docs.spring.io/spring-data/commons/reference/3.3/repositories/query-return-types-reference.html)"
"What is the return type for a Spring Data repository method that returns a Project Reactor Flux emitting zero, one, or many elements using reactive repositories?","Flux<T> (Source: https://docs.spring.io/spring-data/commons/reference/3.3/repositories/query-return-types-reference.html)"
