"What is the Spring Data Commons project and what does it apply?","The Spring Data Commons project applies core Spring concepts to the development of solutions using many relational and non-relational data stores. (Source: https://docs.spring.io/spring-data/commons/reference/3.3/index.html)"
"Where can I find the version control for the Spring Data Commons project?","You can find the version control for the Spring Data Commons project at github.com/spring-projects/spring-data-commons. (Source: https://docs.spring.io/spring-data/commons/reference/3.3/index.html)"
"How can I report a bug or issue with the Spring Data Commons project?","You can report a bug or issue with the Spring Data Commons project at github.com/spring-projects/spring-data-commons/issues. (Source: https://docs.spring.io/spring-data/commons/reference/3.3/index.html)"
"What is the easiest way to find compatible versions of Spring Data modules?","The easiest way to find compatible versions of Spring Data modules is to rely on the Spring Data Release Train BOM that defines compatible versions. (Source: https://docs.spring.io/spring-data/commons/reference/3.3/dependencies.html)"
"How do you declare the Spring Data BOM dependency in a Maven project?","In a Maven project, you would declare this dependency in the <dependencyManagement /> section of your POM as follows: <dependencyManagement> <dependencies> <dependency> <groupId>org.springframework.data</groupId> <artifactId>spring-data-bom</artifactId> <version>2024.0.4</version> <scope>import</scope> <type>pom</type> </dependency> </dependencies> </dependencyManagement> (Source: https://docs.spring.io/spring-data/commons/reference/3.3/dependencies.html)"
"What is the current release train version of Spring Data?","The current release train version of Spring Data is 2024.0.4. (Source: https://docs.spring.io/spring-data/commons/reference/3.3/dependencies.html)"
"Where can I find instructions on how to upgrade from earlier versions of Spring Data?","Instructions for upgrading from earlier versions of Spring Data are provided on the project wiki (Source: https://github.com/spring-projects/spring-data-commons/wiki)."
"How do I find the specific version I want to upgrade to?","Follow the links in the release notes section (Source: https://github.com/spring-projects/spring-data-commons/wiki#release-notes) to find the version that you want to upgrade to."
"What should I do if I am more than one release behind?","If you are more than one release behind, please make sure that you also review the release notes of the versions that you jumped (Source: https://github.com/spring-projects/spring-data-commons/wiki#release-notes)."
"How does Spring Data automatically detect a persistent entity's constructor to be used to materialize objects of that type?","The resolution algorithm works as follows: If there is a constructor that is annotated with @PersistenceCreator, it is used. If the type is a Kotlin data class, the primary constructor is used. If there is a single static factory method annotated with @PersistenceCreator, then it is used. If there is a single constructor, it is used. If there are multiple constructors and exactly one is annotated with @PersistenceCreator, it is used. If the type is a Java Record, the canonical constructor is used. If there's a no-argument constructor, it is used. Other constructors will be ignored. (Source: https://docs.spring.io/spring-data/commons/reference/3.3/object-mapping.html)"
"What is the purpose of the @PersistenceCreator annotation in Spring Data object mapping?","The @PersistenceCreator annotation is used to indicate a constructor preference for object creation in Spring Data. It can be used to customize the default constructor resolution algorithm. (Source: https://docs.spring.io/spring-data/commons/reference/3.3/object-mapping.html)"
"How does Spring Data handle overridden properties in Kotlin classes?","Spring Data adapts specifics of Kotlin to allow object creation and mutation. Spring Data automatically tries to detect a persistent entity's constructor to be used to materialize objects of that type. The resolution algorithm works as follows: If there is a constructor that is annotated with @PersistenceCreator, it is used. If the type is a Kotlin data class, the primary constructor is used. If there is a single static factory method annotated with @PersistenceCreator, then it is used. If there is a single constructor, it is used. If there are multiple constructors and exactly one is annotated with @PersistenceCreator, it is used. If the type is a Java Record, the canonical constructor is used. If there's a no-argument constructor, it is used. Other constructors will be ignored. (Source: https://docs.spring.io/spring-data/commons/reference/3.3/object-mapping.html)"
"What is the primary purpose of the Spring Data repository abstraction?","The primary purpose of the Spring Data repository abstraction is to significantly reduce the amount of boilerplate code required to implement data access layers for various persistence stores. (Source: https://docs.spring.io/spring-data/commons/reference/3.3/repositories.html)"
"Where can I find detailed information on the specific features of my Spring Data module?","For detailed information on the specific features of your Spring Data module, see the chapter on that module of this document. (Source: https://docs.spring.io/spring-data/commons/reference/3.3/repositories.html)"
"Is XML configuration supported across all Spring Data modules that support the repository API?","Yes, XML configuration is supported across all Spring Data modules that support the repository API. For more information, refer to the 'Namespace reference' chapter. (Source: https://docs.spring.io/spring-data/commons/reference/3.3/repositories.html)"
"What is the central interface in the Spring Data repository abstraction?","The central interface in the Spring Data repository abstraction is Repository. (Source: {https://docs.spring.io/spring-data/commons/reference/3.3/repositories/core-concepts.html})"
"What interfaces provide CRUD functionality for the entity class being managed?","CrudRepository and ListCrudRepository interfaces provide CRUD functionality for the entity class being managed. (Source: {https://docs.spring.io/spring-data/commons/reference/3.3/repositories/core-concepts.html})"
"What additional methods are provided by PagingAndSortingRepository and ListPagingAndSortingRepository?","PagingAndSortingRepository and ListPagingAndSortingRepository provide additional methods to ease paginated access to entities. (Source: {https://docs.spring.io/spring-data/commons/reference/3.3/repositories/core-concepts.html})"
"How do you define a repository interface in Spring Data?","To define a repository interface, you first need to define a domain class-specific repository interface. The interface must extend Repository and be typed to the domain class and an ID type. If you want to expose CRUD methods for that domain type, you may extend CrudRepository, or one of its variants instead of Repository. (Source: https://docs.spring.io/spring-data/commons/reference/3.3/repositories/definition.html)"
"What is the difference between CrudRepository and ListCrudRepository in Spring Data?","CrudRepository provides methods for CRUD functionality, while ListCrudRepository is similar to CrudRepository but returns a List instead of an Iterable for methods that return multiple entities, which might be easier to use. (Source: https://docs.spring.io/spring-data/commons/reference/3.3/repositories/definition.html)"
"How can you selectively expose CRUD methods in a repository interface in Spring Data?","To selectively expose CRUD methods, you can copy the methods you want to expose from the CrudRepository into your domain repository. When doing so, you may change the return type of methods. Spring Data will honor the return type if possible. (Source: https://docs.spring.io/spring-data/commons/reference/3.3/repositories/definition.html)"
"What are the three strategies available for the repository infrastructure to resolve a query in Spring Data?","The three strategies available for the repository infrastructure to resolve a query in Spring Data are CREATE, USE_DECLARED_QUERY, and CREATE_IF_NOT_FOUND. Source: https://docs.spring.io/spring-data/commons/reference/3.3/repositories/query-methods-details.html"
"How can you define sorting expressions in Spring Data?","You can define sorting expressions in Spring Data by using property names or by using the type-safe API that makes use of runtime proxies by (typically) using CGlib. Source: https://docs.spring.io/spring-data/commons/reference/3.3/repositories/query-methods-details.html"
"What is the difference between using Top and First keywords to limit query results in Spring Data?","The Top and First keywords in Spring Data can be used interchangeably to limit query results, but the First keyword is used when you want to return the first result only, while Top allows you to specify the maximum result size. Source: https://docs.spring.io/spring-data/commons/reference/3.3/repositories/query-methods-details.html"
"What is the purpose of the @DomainEvents annotation in Spring Data?","The @DomainEvents annotation in Spring Data is used to make the publication of domain events from an aggregate root as easy as possible. (Source: https://docs.spring.io/spring-data/commons/reference/3.3/repositories/core-domain-events.html)"
"What is the difference between the @DomainEvents and @AfterDomainEventPublication annotations?","The @DomainEvents annotation is used to return a single event instance or a collection of events, while the @AfterDomainEventPublication annotation is used to clean up the list of events to be published after all events have been published. (Source: https://docs.spring.io/spring-data/commons/reference/3.3/repositories/core-domain-events.html)"
"In which methods of a Spring Data repository will the @DomainEvents and @AfterDomainEventPublication methods be called?","The @DomainEvents and @AfterDomainEventPublication methods will be called in the save(...), saveAll(...), delete(...), deleteAll(...), deleteAllInBatch(...), and deleteInBatch(...) methods of a Spring Data repository. (Source: https://docs.spring.io/spring-data/commons/reference/3.3/repositories/core-domain-events.html)"
"What is the purpose of the Querydsl extension in Spring Data?","The Querydsl extension in Spring Data enables the construction of statically typed SQL-like queries through its fluent API. It offers integration with Querydsl through QuerydslPredicateExecutor, which provides several methods for finding, counting, and checking the existence of entities based on a Predicate. (Source: https://docs.spring.io/spring-data/commons/reference/3.3/repositories/core-extensions.html)"
"How can I use the Querydsl support in my repository interface?","To use the Querydsl support, extend QuerydslPredicateExecutor on your repository interface. This allows you to write type-safe queries using Querydsl Predicate instances. For example, you can use the following interface to extend QuerydslPredicateExecutor: public interface UserRepository extends CrudRepository<User, Long>, QuerydslPredicateExecutor<User> {}. (Source: https://docs.spring.io/spring-data/commons/reference/3.3/repositories/core-extensions.html)"
"What is the purpose of the @EnableSpringDataWebSupport annotation in Spring Data?","The @EnableSpringDataWebSupport annotation in Spring Data enables a variety of web support for Spring Data modules that support the repository programming model. It registers several components, including a DomainClassConverter, HandlerMethodArgumentResolver implementations for Pageable and Sort, and Jackson modules for de-/serializing types like Point and Distance. It also detects Spring HATEOAS on the classpath and registers integration components for it. (Source: https://docs.spring.io/spring-data/commons/reference/3.3/repositories/core-extensions.html)"
"What is scrolling in Spring Data?","Scrolling is a more fine-grained approach to iterate through larger result sets in chunks. It consists of a stable sort, a scroll type (Offset- or Keyset-based scrolling), and result limiting. (Source: https://docs.spring.io/spring-data/commons/reference/3.3/repositories/scrolling.html)"
"How can I define simple sorting expressions in Spring Data?","You can define simple sorting expressions by using property names. (Source: https://docs.spring.io/spring-data/commons/reference/3.3/repositories/scrolling.html)"
"What is the difference between ScollPosition.offset() and ScollPosition.offset(0L) in Spring Data?","The former (ScrollPosition.offset()) indicates the start of a scroll operation, pointing to no specific offset, whereas the latter (ScrollPosition.offset(0L)) identifies the first element (at position 0) of the result. Given the exclusive nature of scrolling, using ScollPosition.offset(0) skips the first element and translates to an offset of 1. (Source: https://docs.spring.io/spring-data/commons/reference/3.3/repositories/scrolling.html)"
"What is the purpose of using Java 8's Optional to indicate the potential absence of a value in repository CRUD methods?","Java 8's Optional is used to indicate the potential absence of a value in repository CRUD methods as of Spring Data 2.0. This is to ensure that the absence of a result is clearly indicated and handled appropriately. (Source: https://docs.spring.io/spring-data/commons/reference/3.3/repositories/null-handling.html)"
"What are the wrapper types supported by Spring Data for query methods?","The wrapper types supported by Spring Data for query methods include com.google.common.base.Optional, scala.Option, and io.vavr.control.Option. These are used to indicate the potential absence of a value in query results. (Source: https://docs.spring.io/spring-data/commons/reference/3.3/repositories/null-handling.html)"
"How can you express nullability constraints for repository methods in Spring Data?","Nullability constraints for repository methods in Spring Data can be expressed using Spring Framework's nullability annotations. These annotations provide a tooling-friendly approach and opt-in null checks during runtime. (Source: https://docs.spring.io/spring-data/commons/reference/3.3/repositories/null-handling.html)"
"What is the purpose of projections in Spring Data?","Projections in Spring Data are used to create partial views of managed aggregates, allowing for more selective retrieval of data. (Source: https://docs.spring.io/spring-data/commons/reference/3.3/repositories/projections.html)"
"How can you limit the result of a query to only the name attributes of a Person entity using projection interfaces?","To limit the result of a query to only the name attributes of a Person entity, you can declare an interface that exposes accessor methods for the properties to be read. This interface is then used as the return type for the query method in the repository. (Source: https://docs.spring.io/spring-data/commons/reference/3.3/repositories/projections.html)"
"What is the difference between closed and open projections in Spring Data?","A closed projection is a projection interface whose accessor methods all match properties of the target aggregate, while an open projection uses accessor methods to compute new values by using the @Value annotation. Spring Data can optimize the query execution for closed projections but not for open projections. (Source: https://docs.spring.io/spring-data/commons/reference/3.3/repositories/projections.html)"
"What is Query by Example (QBE) and what are its core concepts?","Query by Example (QBE) is a user-friendly querying technique with a simple interface. It allows dynamic query creation and does not require you to write queries that contain field names. The core concepts of Query by Example include Probe, ExampleMatcher, Example, and FetchableFluentQuery. (Source: https://docs.spring.io/spring-data/commons/reference/3.3/query-by-example.html)"
"What are some limitations of Query by Example?","Query by Example has several limitations, such as no support for nested or grouped property constraints, store-specific support on string matching, and exact matching for other property types. (Source: https://docs.spring.io/spring-data/commons/reference/3.3/query-by-example.html)"
"How can you customize the matching behavior in Query by Example using ExampleMatcher?","You can customize the matching behavior in Query by Example using ExampleMatcher by specifying your own defaults for string matching, null handling, and property-specific settings. You can also configure matcher options and case sensitivity for individual properties. (Source: https://docs.spring.io/spring-data/commons/reference/3.3/query-by-example.html)"
"What is a Value Expression in Spring Data?","A Value Expression is a combination of Spring Expression Language (SpEL) and Property Placeholder Resolution that allows for the evaluation of programmatic expressions and the retrieval of values from the Environment such as configuration properties. They are defined by a trusted input such as an annotation value and are not determined from user input."
"How are Value Expressions parsed and evaluated in Spring Data?","Value Expressions are parsed by the ValueExpressionParser API. Instances of ValueExpression are thread-safe and can be cached for later use to avoid repeated parsing. The evaluation of expressions is done using an EvaluationContext provided by EvaluationContextProvider."
"What is the difference between a SpEL Expression and a Property Placeholder in Value Expressions?","A SpEL Expression is a Template style expression enclosed within the #{...} format, while a Property Placeholder is a form ${...} that refers to properties provided by a PropertySource through Environment."
"How can an entity class be equipped with auditing metadata in Spring Data?","An entity class can be equipped with auditing metadata in Spring Data either using annotations or by implementing an interface. (Source: https://docs.spring.io/spring-data/commons/reference/3.3/auditing.html)"
"What are the annotations used to capture when changes are made to an entity in Spring Data?","@CreatedBy, @LastModifiedBy, @CreatedDate, and @LastModifiedDate are the annotations used to capture when changes are made to an entity in Spring Data. (Source: https://docs.spring.io/spring-data/commons/reference/3.3/auditing.html)"
"What is the purpose of the AuditorAware interface in Spring Data auditing?","The AuditorAware interface is used in Spring Data auditing to make the infrastructure aware of the current principal when using @CreatedBy or @LastModifiedBy. (Source: https://docs.spring.io/spring-data/commons/reference/3.3/auditing.html)"
"What is the purpose of the CustomConversions class in Spring Data?","CustomConversions is the central facility that allows registration and querying for registered converters based on source- and target type. It ships with a pre-defined set of converter registrations, including JSR-310 Converters for conversion between java.time, java.util.Date, and String types. (Source: https://docs.spring.io/spring-data/commons/reference/3.3/custom-conversions.html)"
"How does Spring Data determine whether to register a converter as a reading or writing converter?","Spring Data inspects the Converter implementations for the source and target types they convert from and to. Depending on whether one of those is a type the underlying data access API can handle natively, the converter instance is registered as a reading or a writing converter. (Source: https://docs.spring.io/spring-data/commons/reference/3.3/custom-conversions.html)"
"What is the difference between a writing converter and a reading converter in Spring Data?","A writing converter is used to convert from a source type to a target type, while a reading converter is used to convert from a target type to a source type. The difference lies in the order of the qualifiers on Converter. (Source: https://docs.spring.io/spring-data/commons/reference/3.3/custom-conversions.html)"
"How does Spring Data determine whether an entity is new by default?","By default, Spring Data inspects the identifier property of the given entity. If the identifier property is null or 0 in case of primitive types, then the entity is assumed to be new. Otherwise, it is assumed to not be new. (Source: https://docs.spring.io/spring-data/commons/reference/3.3/is-new-state-detection.html)"
"What happens if a property annotated with @Version is present and null or 0 in case of a version property of primitive type?","If a property annotated with @Version is present and null, or in case of a version property of primitive type 0, the entity is considered new. If the version property is present but has a different value, the entity is considered to not be new. (Source: https://docs.spring.io/spring-data/commons/reference/3.3/is-new-state-detection.html)"
"How can you customize the EntityInformation abstraction used in the repository base implementation?","You can customize the EntityInformation abstraction used in the repository base implementation by creating a subclass of the module specific repository factory and overriding the getEntityInformation(…) method. You then have to register the custom implementation of module specific repository factory as a Spring bean. (Source: https://docs.spring.io/spring-data/commons/reference/3.3/is-new-state-detection.html)"
"What is Kotlin and what platforms does it target?","Kotlin is a statically typed language that targets the JVM (and other platforms). It allows writing concise and elegant code while providing excellent interoperability with existing libraries written in Java. (Source: https://kotlinlang.org)"
"How does Spring Data support Kotlin applications?","Spring Data provides first-class support for Kotlin and lets developers write Kotlin applications almost as if Spring Data was a Kotlin native framework. (Source: https://docs.spring.io/spring-data/commons/reference/3.3/kotlin.html)"
"How can I build a Spring application with Kotlin using Spring Boot?","The easiest way to build a Spring application with Kotlin is to leverage Spring Boot and its dedicated Kotlin support. A comprehensive tutorial will teach you how to build Spring Boot applications with Kotlin using start.spring.io. (Source: https://docs.spring.io/spring-boot/docs/current/reference/html/boot-features-kotlin.html)"
"What version of Kotlin is supported by Spring Data?","Spring Data supports Kotlin 1.3 (Source: https://docs.spring.io/spring-data/commons/reference/3.3/kotlin/requirements.html)"
"What libraries are required to be present on the classpath for Spring Data to work with Kotlin?","kotlin-stdlib (or one of its variants, such as kotlin-stdlib-jdk8 ) and kotlin-reflect are required to be present on the classpath (Source: https://docs.spring.io/spring-data/commons/reference/3.3/kotlin/requirements.html)"
"How can I bootstrap a Kotlin project to ensure that the required libraries for Spring Data are included by default?","You can bootstrap a Kotlin project via start.spring.io (https://start.spring.io/#!language=kotlin&type=gradle-project) to ensure that the required libraries for Spring Data are included by default (Source: https://docs.spring.io/spring-data/commons/reference/3.3/kotlin/requirements.html)"
"What is the main feature of Kotlin that helps in dealing with null values at compile time?","Null Safety (Source: https://docs.spring.io/spring-data/commons/reference/3.3/kotlin/null-safety.html)"
"How does Kotlin handle null safety compared to Java?","Kotlin allows using functional constructs with nullable values and provides null safety for the whole Spring Data API to Kotlin developers, dealing with null related issues at compile time. Java does not let you express null safety in its type system. (Source: https://docs.spring.io/spring-data/commons/reference/3.3/kotlin/null-safety.html)"
"What are the options for configuring JSR-305 checks in Kotlin?","-Xjsr305={strict|warn|ignore} (Source: https://docs.spring.io/spring-data/commons/reference/3.3/kotlin/null-safety.html)"
"How are Kotlin objects materialized in Spring Data?","The process of materializing Kotlin objects in Spring Data is detailed in the Kotlin support section of Object Mapping. (Source: https://docs.spring.io/spring-data/commons/reference/3.3/kotlin/object-mapping.html)"
"Where can I find information on how to work with Kotlin objects in Spring Data?","You can find detailed information on working with Kotlin objects in Spring Data in the Kotlin support section of Object Mapping. (Source: https://docs.spring.io/spring-data/commons/reference/3.3/kotlin/object-mapping.html)"
"What is the purpose of the Kotlin support section in Object Mapping for Spring Data?","The Kotlin support section in Object Mapping for Spring Data provides information on how Kotlin objects are materialized and how to work with them. (Source: https://docs.spring.io/spring-data/commons/reference/3.3/kotlin/object-mapping.html)"
"What are Kotlin extensions and how do they enhance Spring Data APIs?","Kotlin extensions are a feature that allows you to add new functionality to existing classes. Spring Data Kotlin APIs use these extensions to provide additional Kotlin-specific conveniences to existing Spring APIs. This makes the API more Kotlin-friendly and easier to use. (Source: https://docs.spring.io/spring-data/commons/reference/3.3/kotlin/extensions.html)"
"Why are Kotlin reified type parameters important in Spring Data Kotlin APIs?","Kotlin reified type parameters provide a workaround for JVM generics type erasure, which is a limitation in Java. This allows Spring Data to take advantage of this feature and create a better Kotlin API. (Source: https://docs.spring.io/spring-data/commons/reference/3.3/kotlin/extensions.html)"
