"url","content"
"https://docs.spring.io/spring-modulith/reference/testing.html","Integration Testing Application Modules: Spring Modulith allows to run integration tests bootstrapping individual application modules in isolation or combination with others. To achieve this, place a JUnit test class in an application module package or any sub-package of that and annotate it with @ApplicationModuleTest : An application module integration test class Java Kotlin package example.order; @ApplicationModuleTest class OrderIntegrationTests { // Individual test cases go here } package example.order @ApplicationModuleTest class OrderIntegrationTests { // Individual test cases go here } This will run your integration test similar to what @SpringBootTest would have achieved but with the bootstrap actually limited to the application module the test resides in. If you configure the log level for org.springframework.modulith to DEBUG , you will see detailed information about how the test execution customizes the Spring Boot bootstrap: The log output of an application module integration test bootstrap . ____ _ __ _ _ /\\ / ___'_ __ _ _(_)_ __ __ _ \ \ \ \ ( ( )\___ | '_ | '_| | '_ \/ _` | \ \ \ \ \\/ ___)| |_)| | | | | || (_| | ) ) ) ) ' |____| .__|_| |_|_| |_\__, | / / / / =========|_|==============|___/=/_/_/_/ :: Spring Boot :: (v3.0.0-SNAPSHOT) … - Bootstrapping @ApplicationModuleTest for example.order in mode STANDALONE (class example.Application)… … - ====================================================================================================== … - ## example.order ## … - > Logical name: order … - > Base package: example.order … - > Direct module dependencies: none … - > Spring beans: … - + ….OrderManagement … - + ….internal.OrderInternal … - Starting OrderIntegrationTests using Java 17.0.3 … … - No active profile set, falling back to 1 default profile: ""default"" … - Re-configuring auto-configuration and entity scan packages to: example.order. Note, how the output contains the detailed information about the module included in the test run. It creates the application module, finds the module to be run and limits the application of auto-configuration, component and entity scanning to the corresponding packages. Bootstrap Modes: The application module test can be bootstrapped in a variety of modes: STANDALONE (default) — Runs the current module only. DIRECT_DEPENDENCIES — Runs the current module as well as all modules the current one directly depends on. ALL_DEPENDENCIES — Runs the current module and the entire tree of modules depended on. Dealing with Efferent Dependencies: When an application module is bootstrapped, the Spring beans it contains will be instantiated. If those contain bean references that cross module boundaries, the bootstrap will fail if those other modules are not included in the test run (see Bootstrap Modes(#bootstrap-modes) for details). While a natural reaction might be to expand the scope of the application modules included, it is usually a better option to mock the target beans. Mocking Spring bean dependencies in other application modules Java Kotlin @ApplicationModuleTest class InventoryIntegrationTests { @MockBean SomeOtherComponent someOtherComponent; } @ApplicationModuleTest class InventoryIntegrationTests { @MockBean SomeOtherComponent someOtherComponent } Spring Boot will create bean definitions and instances for the types defined as @MockBean and add them to the ApplicationContext bootstrapped for the test run. If you find your application module depending on too many beans of other ones, that is usually a sign of high coupling between them. The dependencies should be reviewed for whether they are candidates for replacement by publishing domain events(events.html#events) . Defining Integration Test Scenarios: Integration testing application modules can become a quite elaborate effort. Especially if the integration of those is based on asynchronous, transactional event handling(events.html#aml) , dealing with the concurrent execution can be subject to subtle errors. Also, it requires dealing with quite a few infrastructure components: TransactionOperations and ApplicationEventProcessor to make sure events are published and delivered to transactional listeners, Awaitility to handle concurrency and AssertJ assertions to formulate expectations on the test execution’s outcome. To ease the definition of application module integration tests, Spring Modulith provides the Scenario abstraction that can be used by declaring it as test method parameter in tests declared as @ApplicationModuleTest . Using the Scenario API in a JUnit 5 test Java Kotlin @ApplicationModuleTest class SomeApplicationModuleTest { @Test public void someModuleIntegrationTest(Scenario scenario) { // Use the Scenario API to define your integration test } } @ApplicationModuleTest class SomeApplicationModuleTest { @Test fun someModuleIntegrationTest(scenario: Scenario) { // Use the Scenario API to define your integration test } } The test definition itself usually follows the following skeleton: A stimulus to the system is defined. This is usually either an event publication or an invocation of a Spring component exposed by the module. Optional customization of technical details of the execution (timeouts, etc.) The definition of some expected outcome, such as another application event being fired that matches some criteria or some state change of the module that can be detected by invoking exposed components. Optional, additional verifications made on the received event or observed, changed state. Scenario exposes an API to define these steps and guide you through the definition. Defining a stimulus as starting point of the Scenario Java Kotlin // Start with an event publication scenario.publish(new MyApplicationEvent(…)).… // Start with a bean invocation scenario.stimulate(() -> someBean.someMethod(…)).… // Start with an event publication scenario.publish(MyApplicationEvent(…)).… // Start with a bean invocation scenario.stimulate(Runnable { someBean.someMethod(…) }).… Both the event publication and bean invocation will happen within a transaction callback to make sure the given event or any ones published during the bean invocation will be delivered to transactional event listeners. Note, that this will require a new transaction to be started, no matter whether the test case is already running inside a transaction or not. In other words, state changes of the database triggered by the stimulus will never be rolled back and have to be cleaned up manually. See the ….andCleanup(…) methods for that purpose. The resulting object can now get the execution customized though the generic ….customize(…) method or specialized ones for common use cases like setting a timeout ( ….waitAtMost(…) ). The setup phase will be concluded by defining the actual expectation of the outcome of the stimulus. This can be an event of a particular type in turn, optionally further constraint by matchers: Expecting an event being published as operation result Java Kotlin ….andWaitForEventOfType(SomeOtherEvent.class) .matching(event -> …) // Use some predicate here .… ….andWaitForEventOfType(SomeOtherEvent.class) .matching(event -> …) // Use some predicate here .… These lines set up a completion criteria that the eventual execution will wait for to proceed. In other words, the example above will cause the execution to eventually block until either the default timeout is reached or a SomeOtherEvent is published that matches the predicate defined. The terminal operations to execute the event-based Scenario are named ….toArrive…() and allow to optionally access the expected event published, or the result object of the bean invocation defined in the original stimulus. Triggering the verification Java Kotlin // Executes the scenario ….toArrive(…) // Execute and define assertions on the event received ….toArriveAndVerify(event -> …) // Executes the scenario ….toArrive(…) // Execute and define assertions on the event received ….toArriveAndVerify(event -> …) The choice of method names might look a bit weird when looking at the steps individually but they actually read quite fluent when combined. A complete Scenario definition Java Kotlin scenario.publish(new MyApplicationEvent(…)) .andWaitForEventOfType(SomeOtherEvent.class) .matching(event -> …) .toArriveAndVerify(event -> …); scenario.publish(new MyApplicationEvent(…)) .andWaitForEventOfType(SomeOtherEvent::class.java) .matching { event -> … } .toArriveAndVerify { event -> … } Alternatively to an event publication acting as expected completion signal, we can also inspect the state of the application module by invoking a method on one of the components exposed. The scenario would then rather look like this: Expecting a state change Java Kotlin scenario.publish(new MyApplicationEvent(…)) .andWaitForStateChange(() -> someBean.someMethod(…))) .andVerify(result -> …); scenario.publish(MyApplicationEvent(…)) .andWaitForStateChange { someBean.someMethod(…) } .andVerify { result -> … } The result handed into the ….andVerify(…) method will be the value returned by the method invocation to detect the state change. By default, non- null values and non-empty Optional s will be considered a conclusive state change. This can be tweaked by using the ….andWaitForStateChange(…, Predicate) overload. Customizing Scenario Execution: To customize the execution of an individual scenario, call the ….customize(…) method in the setup chain of the Scenario : Customizing a Scenario execution Java Kotlin scenario.publish(new MyApplicationEvent(…)) .customize(conditionFactory -> conditionFactory.atMost(Duration.ofSeconds(2))) .andWaitForEventOfType(SomeOtherEvent.class) .matching(event -> …) .toArriveAndVerify(event -> …); scenario.publish(MyApplicationEvent(…)) .customize { it.atMost(Duration.ofSeconds(2)) } .andWaitForEventOfType(SomeOtherEvent::class.java) .matching { event -> … } .toArriveAndVerify { event -> … } To globally customize all Scenario instances of a test class, implement a ScenarioCustomizer and register it as JUnit extension. Registering a ScenarioCustomizer Java Kotlin @ExtendWith(MyCustomizer.class) class MyTests { @Test void myTestCase(Scenario scenario) { // scenario will be pre-customized with logic defined in MyCustomizer } static class MyCustomizer implements ScenarioCustomizer { @Override Function<ConditionFactory, ConditionFactory> getDefaultCustomizer(Method method, ApplicationContext context) { return conditionFactory -> …; } } } @ExtendWith(MyCustomizer::class) class MyTests { @Test fun myTestCase(scenario: Scenario) { // scenario will be pre-customized with logic defined in MyCustomizer } class MyCustomizer : ScenarioCustomizer { override fun getDefaultCustomizer(method: Method, context: ApplicationContext): UnaryOperator<ConditionFactory> { return UnaryOperator { conditionFactory -> … } } } }"
"https://docs.spring.io/spring-modulith/reference/moments.html","Moments — a Passage of Time Events API: spring-modulith-moments is a Passage of Time Events implementation heavily inspired by Matthias Verraes blog post(https://verraes.net/2019/05/patterns-for-decoupling-distsys-passage-of-time-event/) . It’s an event-based approach to time to trigger actions that are tied to a particular period of time having passed. To use the abstraction, include the following dependency in your project: Maven Gradle <dependency> <groupId>org.springframework.modulith</groupId> <artifactId>spring-modulith-moments</artifactId> </dependency> dependencies { implementation 'org.springframework.modulith:spring-modulith-moments' } The dependency added to the project’s classpath causes the following things in your application: Application code can refer to HourHasPassed , DayHasPassed , WeekHasPassed , MonthHasPassed , QuarterHasPassed , YearHasPassed types in Spring event listeners to get notified if a certain amount of time has passed. A bean of type org.springframework.modulith.Moments is available in the ApplicationContext that contains the logic to trigger these events. If spring.modulith.moments.enable-time-machine is set to true , that instance will be a org.springframework.modulith.TimeMachine which allows to ""shift"" time and by that triggers all intermediate events, which is useful to integration test functionality that is triggered by the events. By default, Moments uses a Clock.systemUTC() instance. To customize this, declare a bean of type Clock . Java Kotlin @Configuration class MyConfiguration { @Bean Clock myCustomClock() { // Create a custom Clock here } } @Configuration class MyConfiguration { @Bean fun myCustomClock(): Clock { // Create a custom Clock here } } Moments exposes the following application properties for advanced customization: Table 1. Available application properties Property Default value Description spring.modulith.moments.enable-time-machine false If set to true , the Moments instance will be a TimeMachine , that exposes API to shift time forward. Useful for integration tests that expect functionality triggered by the Passage of Time Events. spring.modulith.moments.granularity hours The minimum granularity of events to be fired. Alternative value days to avoid hourly events. spring.modulith.moments.locale Locale.getDefault() The Locale to use when determining week boundaries. spring.modulith.moments.quarter-start-month Months.JANUARY The month at which quarters start. spring.modulith.moments.zone-id ZoneOffset#UTC The ZoneId to determine times which are attached to the events published."
"https://docs.spring.io/spring-modulith/reference/documentation.html","Documenting Application Modules: The application module model created via ApplicationModules can be used to create documentation snippets for inclusion into developer documentation written in Asciidoc. Spring Modulith’s Documenter abstraction can produce two different kinds of snippets: C4 and UML component diagrams describing the relationships between the individual application modules A so-called Application Module Canvas , a tabular overview about the module and the most relevant elements in those (Spring beans, aggregate roots, events published and listened to as well as configuration properties). Additionally, Documenter can produce an aggregating Asciidoc file that includes all existing component diagrams and canvases. Generating Application Module Component diagrams: The documentation snippets can be generated by handing the ApplicationModules instance into a Documenter . Generating application module component diagrams using Documenter Java Kotlin class DocumentationTests { ApplicationModules modules = ApplicationModules.of(Application.class); @Test void writeDocumentationSnippets() { new Documenter(modules) .writeModulesAsPlantUml() .writeIndividualModulesAsPlantUml(); } } class DocumentationTests { private val modules = ApplicationModules.of(Application::class.java) @Test fun writeDocumentationSnippets() { Documenter(modules) .writeModulesAsPlantUml() .writeIndividualModulesAsPlantUml() } } The first call on Documenter will generate a C4 component diagram containing all modules within the system. Figure 1. All modules and their relationships rendered as C4 component diagram The second call will create additional diagrams that only include the individual module and the ones they directly depend on the canvas. Figure 2. A subset of application modules and their relationships starting from the order module rendered as C4 component diagram Using Traditional UML Component Diagrams: If you prefer the traditional UML style component diagrams, tweak the DiagramOptions to rather use that style as follows: Java Kotlin DiagramOptions.defaults() .withStyle(DiagramStyle.UML); DiagramOptions.defaults() .withStyle(DiagramStyle.UML) This will cause the diagrams to look like this: Figure 3. All modules and their relationships rendered as UML component diagram Figure 4. A subset of application modules and their relationships starting from the order module rendered as UML component diagram Generating Application Module Canvases: The Application Module Canvases can be generated by calling Documenter.writeModuleCanvases() : Generating application module canvases using Documenter Java Kotlin class DocumentationTests { ApplicationModules modules = ApplicationModules.of(Application.class); @Test void writeDocumentationSnippets() { new Documenter(modules) .writeModuleCanvases(); } } class DocumentationTests { private val modules = ApplicationModules.of(Application::class.java) @Test fun writeDocumentationSnippets() { Documenter(modules) .writeModuleCanvases() } } By default, the documentation will be generated to spring-modulith-docs folder in your build system’s build folder. A generated canvas looks like this: Table 1. A sample Application Module Canvas Base package com.acme.commerce.inventory Spring components Services c.a.c.i.InventoryManagement Repositories c.a.c.i.Inventory Event listeners c.a.c.i.InternalInventoryListeners listening to o.s.m.m.DayHasPassed , c.a.c.i.QuantityReduced c.a.c.i.InventoryOrderEventListener listening to c.a.c.o.OrderCanceled , c.a.c.o.OrderCompleted Configuration properties c.a.c.i.InventoryProperties Others c.a.c.i.InventoryItemCreationListener Aggregate roots c.a.c.i.InventoryItem Published events c.a.c.i.QuantityReduced created by: c.a.c.i.InventoryItem.decreaseQuantity(…) c.a.c.i.StockShort created by: c.a.c.i.InternalInventoryListeners.on(…) Events listened to c.a.c.o.OrderCompleted c.a.c.o.OrderCanceled Properties acme.commerce.inventory.restock-threshold — c.a.c.c.Quantity . The threshold at which a InventoryEvents.StockShort is supposed to be triggered during inventory updates. It consists of the following sections: The application module’s base package. The Spring beans exposed by the application module, grouped by stereotype. — In other words, beans that are located in either the API package or any named interface package(fundamentals.html#modules.named-interfaces) . This will detect component stereotypes defined by jMolecules architecture abstractions(https://github.com/xmolecules/jmolecules/tree/main/jmolecules-architecture) , but also standard Spring stereotype annotations. Exposed aggregate roots — Any entities that we find repositories for or explicitly declared as aggregate via jMolecules. Application events published by the module — Those event types need to be demarcated using jMolecules @DomainEvent or implement its DomainEvent interface. Application events listened to by the module — Derived from methods annotated with Spring’s @EventListener , @TransactionalEventListener , jMolecules' @DomainEventHandler or beans implementing ApplicationListener . Configuration properties — Spring Boot Configuration properties exposed by the application module. Requires the usage of the spring-boot-configuration-processor artifact to extract the metadata attached to the properties. Generating an Aggregating Document: When using Documenter.writeDocumentation(…) an all-docs.adoc file will be generated, linking all generated diagrams and Application Module Canvases. We can manually generate the aggregating document by calling Documenter.writeAggregatingDocument() : Generating an aggregating document using Documenter Java Kotlin class DocumentationTests { ApplicationModules modules = ApplicationModules.of(Application.class); @Test void writeDocumentationSnippets() { new Documenter(modules) .writeAggregatingDocument(); } } class DocumentationTests { private val modules = ApplicationModules.of(Application::class.java) @Test fun writeDocumentationSnippets() { Documenter(modules) .writeAggregatingDocument() } } The aggregating document will include any existing application module component diagrams and application module canvases. If there are none, then this method will not produce an output file."
"https://docs.spring.io/spring-modulith/reference/runtime.html","Spring Modulith Runtime Support: The functionality described in previous chapters have all used the application module arrangement in either testing scenarios for verification and documentation purposes or were general support functionality that help to loosely couple modules but did not work with the application module structure directly. In this section we are going to describe Spring Modulith’s support for module initialization at application runtime. Setting up Runtime Support for Application Modules: To enable the runtime support for Spring Modulith, make sure you include the spring-modulith-runtime JAR in your project. Maven Gradle <dependency> <groupId>org.springframework.modulith</groupId> <artifactId>spring-modulith-runtime</artifactId> <scope>runtime</scope> </dependency> dependencies { runtimeOnly 'org.springframework.modulith:spring-modulith-runtime' } It’s worth noting that using the runtime support of Spring Modulith will mean that you include both ArchUnit(https://www.archunit.org/) and the JGraphT(https://jgrapht.org/) (required to topologically sort application modules) library in your application. Adding this JAR will cause Spring Boot auto-configuration to run that registers the following components in your application: An ApplicationModulesRuntime that allows to access the ApplicationModules . A SpringBootApplicationRuntime to back the former bean to detect the main application class. An event listener for ApplicationStartedEvent(https://docs.spring.io/spring-boot/docs/current/reference/htmlsingle/#features.spring-application.application-events-and-listeners) s that will invoke ApplicationModuleInitializer(#application-module-initializer) beans defined in the application context. Application Module Initializers: When working with application modules, it is pretty common to need to execute some code specific to an individual module on application startup. This means that the execution order of that code needs to follow the dependency structure of the application modules. If a module B depends on module A, the initialization code of A has to run before the one for B, even if the initializers do not directly depend on another. While developers could of course define the execution order via Spring’s standard @Order annotation or Ordered interface, Spring Modulith provides an ApplicationModuleInitializer interface for beans to be run on application startup. The execution order of those beans will automatically follow the application module dependency structure. Java Kotlin @Component class MyInitializer implements ApplicationModuleInitializer { @Override public void initialize() { // Initialization code goes here } } @Component class MyInitializer : ApplicationModuleInitializer { override fun initialize() { // Initialization code goes here } } Note that the ApplicationModuleInitializer beans will only be invoked if the spring-modulith-runtime JAR is on the classpath (see Setting up Runtime Support for Application Modules(#setup) ) as that pulls in the dependencies that are needed to topologically sort the initializers according to the application module structure."
